,Text_clean,positive_score,negative_score,polarity_score,number_words,subjectivity,Sentiment
1154,fate loooves irony haha,0,1,-0.9999990000010001,4,0.24999993750001562,Most Negative
1155,glad spacex could help we are prioritizing emergency responders &amp locations with no internet connectivity at all,1,1,0.0,10,0.19999998000000202,Neutral
1156,true,0,0,0.0,1,0.0,Neutral
1157,thats total market not all tesla we do see tesla reaching m vehicles year probably before  bu,0,0,0.0,8,0.0,Neutral
1158,total market,0,0,0.0,2,0.0,Neutral
1159,seven years for sure to m+ new fully electric vehicles per year six years maybe five ye,0,0,0.0,8,0.0,Neutral
1160,both will do original cars,0,0,0.0,2,0.0,Neutral
1161,we arent cutting the price of model to k i was referring to a future car that will be smaller than model ,0,0,0.0,9,0.0,Neutral
1162,what about a heavy duty paintball machine gun mounted on the bed rails,0,0,0.0,8,0.0,Neutral
1163,new version coming soon,0,0,0.0,2,0.0,Neutral
1164,suppliers were only doing high energy nickel ourselves at least for now also maybe the presenta,0,0,0.0,5,0.0,Neutral
1165,,0,0,0.0,0,0.0,Neutral
1166,,0,0,0.0,0,0.0,Neutral
1167,u+fu+f,0,0,0.0,1,0.0,Neutral
1168,checking into it,0,0,0.0,1,0.0,Neutral
1169,totally up to you but if you head to a tesla delivery center near you &amp maybe help out new owners that would be cool,1,0,0.9999990000010001,9,0.11111109876543349,Most Positive
1170,completely agree,0,0,0.0,2,0.0,Neutral
1171,yes the flaps are now directly driven by electric motors with a gearbox no more hydraulics,0,0,0.0,7,0.0,Neutral
1172,thanks tesla team for great work on deliveries for new owners we super appreciate accommodating us on delivery ti,4,0,0.9999997500000625,10,0.39999996000000404,Most Positive
1173,there are times when i feel like im living in a dilbert cartoon,1,0,0.9999990000010001,6,0.16666663888889352,Most Positive
1174,that species has stood the test of time,0,0,0.0,4,0.0,Neutral
1175,mostly l some  broke at to interface sn will,0,1,-0.9999990000010001,3,0.33333322222225925,Most Negative
1176,bar differential in ullage bar at base due to propellant head it,0,0,0.0,8,0.0,Neutral
1177,we just need enough height to test body flaps &amp drawing propellant from headers vs main tanks will do se,1,1,0.0,12,0.16666665277777895,Neutral
1178,first flight is to km or ~ ft,0,0,0.0,4,0.0,Neutral
1179,nosecone &amp front flaps next week sn next month,0,0,0.0,8,0.0,Neutral
1180,starship sn with rear body flaps,0,0,0.0,5,0.0,Neutral
1181,,0,0,0.0,0,0.0,Neutral
1182,sure,0,0,0.0,0,0.0,Neutral
1183,true,0,0,0.0,1,0.0,Neutral
1184, falcon will launch super cool interstellar mapping and acceleration probe imap which will help researchers better,3,0,0.9999996666667778,10,0.299999970000003,Most Positive
1185,not bad,0,1,-0.9999990000010001,1,0.9999990000010001,Most Negative
1186,exactly,0,0,0.0,0,0.0,Neutral
1187,sandy munro understands engineering,0,0,0.0,4,0.0,Neutral
1188,turns out they mostly press the letter s &amp u+fa on the typewriter u+f,0,0,0.0,8,0.0,Neutral
1189,centaur with a bow obviously,0,0,0.0,2,0.0,Neutral
1190,haha,0,0,0.0,1,0.0,Neutral
1191,something like this,1,0,0.9999990000010001,0,1000000.0,Most Positive
1192,cant support wheel vehicles not safe enough,3,0,0.9999996666667778,4,0.7499998125000469,Most Positive
1193,~mm,0,0,0.0,1,0.0,Neutral
1194,something appealing about hawking hartle idea but i agree with turok feldbrugge lehners,1,0,0.9999990000010001,8,0.12499998437500197,Most Positive
1195,u+fa ur algo,0,0,0.0,3,0.0,Neutral
1196,true,0,0,0.0,1,0.0,Neutral
1197,there are some practical size constraints too cant be too big to fit in the engine comp,0,0,0.0,7,0.0,Neutral
1198,doesnt seem to be a problem we could probably increase area ratio given bar max de,0,1,-0.9999990000010001,8,0.12499998437500197,Most Negative
1199,,0,0,0.0,0,0.0,Neutral
1200,preburners ignite then main chamber,0,0,0.0,4,0.0,Neutral
1201,where is our prediction of probability inaccurate,0,1,-0.9999990000010001,3,0.33333322222225925,Most Negative
1202,or energy &amp time but besides that what,0,0,0.0,4,0.0,Neutral
1203,genetic engineering is too slow unless you use a synthetic virus,0,2,-0.99999950000025,5,0.399999920000016,Most Negative
1204,what cant we predict,0,0,0.0,1,0.0,Neutral
1205,yeah but might not need it,0,0,0.0,1,0.0,Neutral
1206,expansion ratio you can a little bit of flow separation towards the end of the nozzle,0,0,0.0,7,0.0,Neutral
1207, completed a full duration test fire of the raptor vacuum engine at spacexs rocket development facility in mcgregor texas http,0,0,0.0,15,0.0,Neutral
1208, rvac and sea level raptor with a human for scale,0,0,0.0,6,0.0,Neutral
1209,only thing beyond ludicrous is plaid,0,1,-0.9999990000010001,3,0.33333322222225925,Most Negative
1210,this does seem like the opposite of open openai is essentially captured by microsoft,1,0,0.9999990000010001,6,0.16666663888889352,Most Positive
1211,haha true,0,0,0.0,2,0.0,Neutral
1212,maybe i will,0,0,0.0,0,0.0,Neutral
1213,jets are so cool,1,0,0.9999990000010001,2,0.499999750000125,Most Positive
1214,pretty much,1,0,0.9999990000010001,1,0.9999990000010001,Most Positive
1215,yes,0,0,0.0,0,0.0,Neutral
1216,yahoo finance is as dumb as it sounds,0,1,-0.9999990000010001,4,0.24999993750001562,Most Negative
1217,yes,0,0,0.0,0,0.0,Neutral
1218,haha,0,0,0.0,1,0.0,Neutral
1219,roadster will be better,1,0,0.9999990000010001,1,0.9999990000010001,Most Positive
1220,probably,0,0,0.0,0,0.0,Neutral
1221,cybertruck atv roadster &amp semic a r s,0,0,0.0,6,0.0,Neutral
1222,thanks for your many years of support through very tough times,2,0,0.99999950000025,4,0.49999987500003124,Most Positive
1223,we will be a little below that this year most challenging year weve ever had but,0,1,-0.9999990000010001,4,0.24999993750001562,Most Negative
1224,thats about right maybe a little faster,2,0,0.99999950000025,1,1.9999980000020001,Most Positive
1225,yes,0,0,0.0,0,0.0,Neutral
1226,cgi irl,0,0,0.0,2,0.0,Neutral
1227,haha,0,0,0.0,1,0.0,Neutral
1228, we drove a model s long range plus for miles in california and believe we could have made it to  explain,0,0,0.0,8,0.0,Neutral
1229,the extreme difficulty of scaling production of new technology is not well understood its  to  harder,1,1,0.0,7,0.285714244897965,Neutral
1230,haha,0,0,0.0,1,0.0,Neutral
1231,we intend to increase not reduce battery cell purchases from panasonic lg &amp catl possibly other partners too h,0,0,0.0,13,0.0,Neutral
1232,important note about tesla battery day unveil tomorrow this affects long term production especially semi cybertr,1,0,0.9999990000010001,13,0.07692307100591762,Most Positive
1233,thanks,0,0,0.0,0,0.0,Neutral
1234,we really need better legs for starship theyre coming,1,0,0.9999990000010001,4,0.24999993750001562,Most Positive
1235,most likely all flaps will fold after landing to reduce wind tip over force t,0,0,0.0,7,0.0,Neutral
1236,fine well do it already u+f,2,0,0.99999950000025,2,0.99999950000025,Most Positive
1237,good analysis although i think we should wait until fsd is a bit more mature,2,0,0.99999950000025,6,0.33333327777778704,Most Positive
1238,im pretty sure tesla could do a much better autocorrect the bar is so low haha,2,0,0.99999950000025,7,0.285714244897965,Most Positive
1239,true,0,0,0.0,1,0.0,Neutral
1240,custom ultra high speed bus &amp efficient cooling,1,0,0.9999990000010001,9,0.11111109876543349,Most Positive
1241,ok,0,0,0.0,0,0.0,Neutral
1242,pretty much any machine learning,1,0,0.9999990000010001,3,0.33333322222225925,Most Positive
1243,its big,0,0,0.0,1,0.0,Neutral
1244,sure,0,0,0.0,0,0.0,Neutral
1245,yeah we will open dojo for training as a web service once we work out the bugs,1,1,0.0,8,0.24999996875000394,Neutral
1246,there are a lot of pointless zeroes in fp neural nets you can chop off of the,0,1,-0.9999990000010001,7,0.1428571224489825,Most Negative
1247,dojo uses our own chips &amp a computer architecture optimized for neural net training not a,0,0,0.0,10,0.0,Neutral
1248,you really want waypoints this much,0,0,0.0,1,0.0,Neutral
1249,for dojo were betting on fp with floating floating point essentially truncating mostly zeroes,0,0,0.0,9,0.0,Neutral
1250,yes,0,0,0.0,0,0.0,Neutral
1251,yes,0,0,0.0,0,0.0,Neutral
1252,therell be lots of green space around factory but building itself is continuous the open areas,0,0,0.0,9,0.0,Neutral
1253,shaped like a diamond &amp aligned on true north,1,0,0.9999990000010001,7,0.1428571224489825,Most Positive
1254,a prior track record of exceptional achievement in engineering *is* required but *no* prior experience working on,2,0,0.99999950000025,14,0.14285713265306196,Most Positive
1255,if you feel neuralink might have incorrectly overlooked your resume or declined to make an offer please lmk in co,0,1,-0.9999990000010001,9,0.11111109876543349,Most Negative
1256,felt i had done enough on the internet zip &amp paypal that my work would,2,0,0.99999950000025,7,0.285714244897965,Most Positive
1257,it took an utterly insane amount of work to move the spacex &amp tesla success probabilities above ~zero,2,2,0.0,12,0.3333333055555579,Neutral
1258,to be frank in the early days i thought there was &gt chance that both spacex &amp tesla would be worth,1,0,0.9999990000010001,12,0.08333332638888948,Most Positive
1259,irrational is such a funny word to describe numbers,0,2,-0.99999950000025,5,0.399999920000016,Most Negative
1260,of course i still love you,1,0,0.9999990000010001,1,0.9999990000010001,Most Positive
1261,sure but which planet,0,0,0.0,1,0.0,Neutral
1262,good movie,1,0,0.9999990000010001,2,0.499999750000125,Most Positive
1263,current was too strong for droneship to hold station thrusters to be upgraded for future missions,2,0,0.99999950000025,9,0.22222219753086697,Most Positive
1264,lot has happened in years,0,0,0.0,3,0.0,Neutral
1265,it will be very insane,0,1,-0.9999990000010001,1,0.9999990000010001,Most Negative
1266,speedrunning factorio in real life,0,0,0.0,4,0.0,Neutral
1267,no but you make some great points important to note that irons cost advantage is partly offset by,3,0,0.9999996666667778,10,0.299999970000003,Most Positive
1268,yup,0,0,0.0,1,0.0,Neutral
1269,fallout shelter is on your tesla tap the entertainment button,0,1,-0.9999990000010001,6,0.16666663888889352,Most Negative
1270,implicit conflation of consumption &amp capital allocation is the foundational error,0,1,-0.9999990000010001,9,0.11111109876543349,Most Negative
1271,great idea,1,0,0.9999990000010001,2,0.499999750000125,Most Positive
1272,u+fa fallout radio u+fa,0,1,-0.9999990000010001,4,0.24999993750001562,Most Negative
1273,there are some eerie parallels between the boring company &amp vault tec we also built our first demonstration tunnel vault in la,0,1,-0.9999990000010001,13,0.07692307100591762,Most Negative
1274,doubles as an underground nuclear shelter u+fu+fd,0,0,0.0,5,0.0,Neutral
1275,yeah,0,0,0.0,1,0.0,Neutral
1276,should be happening soon,0,0,0.0,1,0.0,Neutral
1277,a bit more obscure but starhammer &amp stainless steel rat,1,1,0.0,8,0.24999996875000394,Neutral
1278,at first i thought that was a parrot,0,0,0.0,2,0.0,Neutral
1279,they remind me of these guys,0,0,0.0,2,0.0,Neutral
1280,story of my life,0,0,0.0,2,0.0,Neutral
1281,,0,0,0.0,0,0.0,Neutral
1282,tunnels under cities with self driving electric cars will feel like warp drivefirst operational tunnel under vega,1,1,0.0,11,0.1818181652892577,Neutral
1283,for sure,0,0,0.0,0,0.0,Neutral
1284,good point,1,0,0.9999990000010001,2,0.499999750000125,Most Positive
1285,have you hugged a tunnel today,0,0,0.0,3,0.0,Neutral
1286,good analysis,1,0,0.9999990000010001,2,0.499999750000125,Most Positive
1287,exactly,0,0,0.0,0,0.0,Neutral
1288,gary the snail is still winning but were gaining on him her,2,0,0.99999950000025,4,0.49999987500003124,Most Positive
1289,embrace tunnels,0,0,0.0,2,0.0,Neutral
1290,tunnels are the solution to traffic you can have as many levels as you want usable tunnel depth far e,1,0,0.9999990000010001,7,0.1428571224489825,Most Positive
1291,just a guess but probably mid teens booster &amp stacking on orbital pad are likely limiti,0,0,0.0,10,0.0,Neutral
1292,pretty accurate simulation although sn will use raptors if sn craters sn &amp sn are close behind,2,0,0.99999950000025,12,0.16666665277777895,Most Positive
1293,couldnt agree more major software improvements are already in place to extend its life &amp more coming,1,0,0.9999990000010001,11,0.09090908264462885,Most Positive
1294,definitely not smartwatches &amp phones are yesterdays technology neuralinks are the future,0,0,0.0,8,0.0,Neutral
1295,seems like they should make a whole outfit out of that material,1,0,0.9999990000010001,3,0.33333322222225925,Most Positive
1296,ancient greece had it all &amp then committed suicide nobody digs your grave better than yourself,1,1,0.0,8,0.24999996875000394,Neutral
1297,true,0,0,0.0,1,0.0,Neutral
1298,the lego movie was awesome,1,0,0.9999990000010001,3,0.33333322222225925,Most Positive
1299,the story of civilization first book is a little dry but second book the life of greece is incredible,1,0,0.9999990000010001,8,0.12499998437500197,Most Positive
1300,im wearing your f  engine shirt right now,1,0,0.9999990000010001,4,0.24999993750001562,Most Positive
1301,cumulative mass to orbit per year correc,0,0,0.0,5,0.0,Neutral
1302,thats the number that really matters,0,0,0.0,2,0.0,Neutral
1303,anyone tracking tonnage to orbit per year for all launch vehicles,0,0,0.0,6,0.0,Neutral
1304,one way or another excitement guaranteed support of greater boca padre brownsville community is very much appreciated,3,0,0.9999996666667778,9,0.33333329629630043,Most Positive
1305,sn starship with flaps &amp nosecone should be done in about a week then static fire checkouts static fire fly to ft &amp back,0,2,-0.99999950000025,17,0.11764705190311459,Most Negative
1306,can someone do a boat service from south padre to boca,0,0,0.0,5,0.0,Neutral
1307,exactly problems like that have been addressed,1,1,0.0,2,0.99999950000025,Neutral
1308,yes good insight,1,0,0.9999990000010001,2,0.499999750000125,Most Positive
1309,all frames stitched to single frame tricky as all cameras overlap in different ways,0,1,-0.9999990000010001,8,0.12499998437500197,Most Negative
1310,much,0,0,0.0,0,0.0,Neutral
1311,yes,0,0,0.0,0,0.0,Neutral
1312,releasing private beta in to weeks public beta early access owners who opt in,0,0,0.0,10,0.0,Neutral
1313,and this still isnt using the dramatically better d aka simultaneous surround video from cameras architecture,1,0,0.9999990000010001,8,0.12499998437500197,Most Positive
1314,cool,1,0,0.9999990000010001,1,0.9999990000010001,Most Positive
1315,he has no clue,0,0,0.0,1,0.0,Neutral
1316,sorry to hear that im sure youll figure it out though took us four launches to reach orbit rockets are hard,0,2,-0.99999950000025,9,0.22222219753086697,Most Negative
1317,many exciting things will be unveiled on battery day   u+au+fef,1,0,0.9999990000010001,6,0.16666663888889352,Most Positive
1318,we will make super efficient home hvac with hepa filters one day,2,0,0.99999950000025,8,0.24999996875000394,Most Positive
1319,if reich actually cares about global warming why is he making so much hot air,1,0,0.9999990000010001,7,0.1428571224489825,Most Positive
1320,u+feu+fea natrlich u+feu+fea,0,0,0.0,3,0.0,Neutral
1321,bitte arbeiten sie bei tesla giga berlin es wird super spa machen,1,0,0.9999990000010001,12,0.08333332638888948,Most Positive
1322,try a tesla &amp youre welcome to give it back if you decide you prefer a subaru,2,0,0.99999950000025,9,0.22222219753086697,Most Positive
1323,vera rubin observatory is cool,1,0,0.9999990000010001,4,0.24999993750001562,Most Positive
1324,+=,0,0,0.0,1,0.0,Neutral
1325,munger is right,1,0,0.9999990000010001,1,0.9999990000010001,Most Positive
1326,,0,0,0.0,0,0.0,Neutral
1327,black scholes formula is kinda bs big difference between a finance approximation &amp fundamental physics   pure math,1,1,0.0,15,0.13333332444444504,Neutral
1328,true,0,0,0.0,1,0.0,Neutral
1329,tesla is best understood as a collection of about a dozen startups mostly in series increasingly,1,0,0.9999990000010001,7,0.1428571224489825,Most Positive
1330,tesla r&amp productivity is exceptionally good due to the caliber of engineering talent,3,0,0.9999996666667778,10,0.299999970000003,Most Positive
1331,tesla model s &amp x have hospital grade hepa air filters &amp y are really good too this has a big effect on healt,1,0,0.9999990000010001,15,0.06666666222222252,Most Positive
1332,,0,0,0.0,0,0.0,Neutral
1333, tesla energy ramps hiring at giga new york for accelerated solar production,0,0,0.0,9,0.0,Neutral
1334,touch,0,0,0.0,1,0.0,Neutral
1335,all tesla workers also get stock so their compensation increased proportionately you are a modern day moron,1,1,0.0,9,0.22222219753086697,Neutral
1336, onboard camera view of falcon s saocom b launch and first stage land landing,0,0,0.0,9,0.0,Neutral
1337,yup,0,0,0.0,1,0.0,Neutral
1338,,0,0,0.0,0,0.0,Neutral
1339,rawlinson didnt design model s prototype was done before he joined &amp he left us in the lurch just as t,0,1,-0.9999990000010001,10,0.09999999000000101,Most Negative
1340,were pretty close to the manufacturing size limit for a milled copper &amp steel ja,1,1,0.0,11,0.1818181652892577,Neutral
1341,a la guerre comme la guerre,0,0,0.0,5,0.0,Neutral
1342,haha,0,0,0.0,1,0.0,Neutral
1343,and starts tweeting,0,0,0.0,2,0.0,Neutral
1344,if you bombard earth with enough photons eventually it emits a tesla ak,1,1,0.0,7,0.285714244897965,Neutral
1345,there is already bidirectional communication between human &amp ai via phones &amp computers its just lo,0,0,0.0,11,0.0,Neutral
1346,above  likely to make it,0,0,0.0,1,0.0,Neutral
1347,this is a test engine flight articles are fixed with no gimbal,0,0,0.0,6,0.0,Neutral
1348,worth noting that thrust is only slightly higher with the big bell nozzle version larger bell is primarily,1,0,0.9999990000010001,12,0.08333332638888948,Most Positive
1349, the first raptor vacuum engine rvac for starship has shipped from spacexs rocket factory in hawthorne california to our dev,0,0,0.0,12,0.0,Neutral
1350,yes,0,0,0.0,0,0.0,Neutral
1351,chart understates lithium ion potential by roughly  ,0,0,0.0,6,0.0,Neutral
1352,model rated as most reliable car,1,0,0.9999990000010001,4,0.24999993750001562,Most Positive
1353,turns out you can make anything fly haha,0,0,0.0,4,0.0,Neutral
1354,exactly this is not fully appreciated,1,0,0.9999990000010001,2,0.499999750000125,Most Positive
1355,starship sn flew asimilar hop to sn but it was a much smoother &amp faster operation,2,0,0.99999950000025,11,0.1818181652892577,Most Positive
1356,u+feu+feau+fagiga berlin mannschaftu+fau+feu+feavielen dank fr ihre hervorragende arbeit an giga berlin,0,0,0.0,10,0.0,Neutral
1357,great trip to germany support from government &amp people is super appreciated,4,0,0.9999997500000625,10,0.39999996000000404,Most Positive
1358,u+fu+f,0,0,0.0,1,0.0,Neutral
1359, deployment of starlink satellites confirmed,0,0,0.0,4,0.0,Neutral
1360, liftoff,0,0,0.0,1,0.0,Neutral
1361,trust ur butt haha,1,0,0.9999990000010001,4,0.24999993750001562,Most Positive
1362,an ai with u+f picking as its goal will result in strawberry fields forever,0,0,0.0,8,0.0,Neutral
1363,over time outer will have ~,0,0,0.0,3,0.0,Neutral
1364,yeah,0,0,0.0,1,0.0,Neutral
1365,just go through resonant modes fast its when you hang out there that problems arise,1,2,-0.33333322222225925,6,0.49999991666668053,Negative
1366,the outer ring of booster engines  of  hav,0,0,0.0,5,0.0,Neutral
1367,videodrome,0,0,0.0,1,0.0,Neutral
1368,,0,0,0.0,0,0.0,Neutral
1369,,0,0,0.0,0,0.0,Neutral
1370,sorry sir i think i have momentinertiaphobia,0,1,-0.9999990000010001,2,0.499999750000125,Most Negative
1371, falcon first stage lands at landing zone to complete this boosters fourth flight,0,0,0.0,9,0.0,Neutral
1372,yeah,0,0,0.0,1,0.0,Neutral
1373,lhc tbh,0,0,0.0,2,0.0,Neutral
1374,,0,0,0.0,0,0.0,Neutral
1375,if you ever want to build a long accelerator tunnel straight or circular i know some people,0,0,0.0,7,0.0,Neutral
1376, after launching saocom b and two rideshare payloads to orbit falcon s first stage returns to earth and lands at landing zon,0,0,0.0,12,0.0,Neutral
1377, deployment of saocom b confirmed,0,0,0.0,3,0.0,Neutral
1378, falcon s first stage has landed at landing zone,0,0,0.0,5,0.0,Neutral
1379, liftoff,0,0,0.0,1,0.0,Neutral
1380,cool,1,0,0.9999990000010001,1,0.9999990000010001,Most Positive
1381, snout boops,0,0,0.0,2,0.0,Neutral
1382,physics is the law everything else is a recommendation,1,0,0.9999990000010001,3,0.33333322222225925,Most Positive
1383,if some company has solved a useful thing that we can just buy that would be great its,2,0,0.99999950000025,5,0.399999920000016,Most Positive
1384,tesla germany designed &amp built the vaccine rna printers for curevac but subject to some curevac ip th,0,0,0.0,13,0.0,Neutral
1385,technically james watt measured a pony added  &amp rounded up haha,0,0,0.0,10,0.0,Neutral
1386,also critical thinking,0,1,-0.9999990000010001,2,0.499999750000125,Most Negative
1387,alexander and the rise of hellenism and film studies,0,0,0.0,5,0.0,Neutral
1388,wow i super loved astronomy but took it at queens not penn definitely one of my favorite class,4,0,0.9999997500000625,8,0.4999999375000079,Most Positive
1389,yeah he sent it to me through a mutual physics prof friend at caltech cern very ba,0,0,0.0,8,0.0,Neutral
1390,its too embarrassing,0,1,-0.9999990000010001,1,0.9999990000010001,Most Negative
1391,just learned that my physics prof from penn is head of fermilab &amp still has some of my old homework u+au+fef,0,0,0.0,10,0.0,Neutral
1392,it is unfortunately common for many in academia to overweight the value of ideas &amp underweight bringing,0,2,-0.99999950000025,8,0.24999996875000394,Most Negative
1393,people are extremely unlikely to die of covid sars cov alone if you,0,2,-0.99999950000025,6,0.33333327777778704,Most Negative
1394,that &amp giga berlin are why im headed to germany this week convers,0,0,0.0,9,0.0,Neutral
1395,antibody half life for cov is very short in a study that spacex did working with harvard,0,0,0.0,9,0.0,Neutral
1396,yeah,0,0,0.0,1,0.0,Neutral
1397,one person at tesla out of  was hospitalized in serious condition he,0,0,0.0,4,0.0,Neutral
1398,some of the tests we initially tried at tesla were ~ false positive including some fro,1,1,0.0,8,0.24999996875000394,Neutral
1399,not yet,0,0,0.0,0,0.0,Neutral
1400,yes,0,0,0.0,0,0.0,Neutral
1401,people read too much into this level of detail its not useful for predicting the future nor can,1,0,0.9999990000010001,6,0.16666663888889352,Most Positive
1402,critical feedback is always appreciated btw,1,1,0.0,4,0.49999987500003124,Neutral
1403,we cant have a blanket pass but maybe for some events,0,0,0.0,3,0.0,Neutral
1404,boost,1,0,0.9999990000010001,1,0.9999990000010001,Most Positive
1405,later versions of a larger device would have that potential,0,0,0.0,4,0.0,Neutral
1406,yup,0,0,0.0,1,0.0,Neutral
1407,actually c although the syntax could be improved esthetically,1,0,0.9999990000010001,3,0.33333322222225925,Most Positive
1408,i like c because it avoids class warfare,1,0,0.9999990000010001,3,0.33333322222225925,Most Positive
1409,a nightcap would probably work best,2,0,0.99999950000025,2,0.99999950000025,Most Positive
1410,pretty much,1,0,0.9999990000010001,1,0.9999990000010001,Most Positive
1411,good summary,1,0,0.9999990000010001,2,0.499999750000125,Most Positive
1412,conceptual telepathy,0,0,0.0,2,0.0,Neutral
1413, if you ever fantasize about having been an s engineer working in edisons lab apply to work at ,1,0,0.9999990000010001,7,0.1428571224489825,Most Positive
1414,ahem starting soon,0,0,0.0,2,0.0,Neutral
1415,all of physics is either impossible or trivial it is impossible until you understand it and then it becomes trivial e rutherford,0,4,-0.9999997500000625,7,0.57142848979593,Most Negative
1416,giant gap between experimental medical device for use only in patients with extreme medical problems &amp wid,0,1,-0.9999990000010001,12,0.08333332638888948,Most Negative
1417,testing with shorter rvac skirt went well full length skirt test coming soon,1,0,0.9999990000010001,9,0.11111109876543349,Most Positive
1418,neuralink product demo in hours webcast at ,0,0,0.0,5,0.0,Neutral
1419,raptor reached mt f over half a million pounds of thrust at peak pressure wit,0,0,0.0,10,0.0,Neutral
1420,good chance something will slip but yeah sunday is intense,1,1,0.0,6,0.33333327777778704,Neutral
1421,only need engines,0,0,0.0,1,0.0,Neutral
1422,boring co tunnel in vegas is only a few months from being operational,0,1,-0.9999990000010001,5,0.199999960000008,Most Negative
1423,neuralink this month &amp tesla next month spacex probably october we will have made a lot of progre,0,0,0.0,11,0.0,Neutral
1424,soon,0,0,0.0,0,0.0,Neutral
1425,theyre quite accurate,1,0,0.9999990000010001,2,0.499999750000125,Most Positive
1426,that number sure comes up a lot u+fu+f,0,0,0.0,3,0.0,Neutral
1427,im fine with reasonable drone footage just needs to be at a fair distance &amp not coming r,3,0,0.9999996666667778,10,0.299999970000003,Most Positive
1428,thanks to a smart and hardworking team at tesla these sure are wild times,1,1,0.0,6,0.33333327777778704,Neutral
1429,much appreciated this was a serious attack,1,1,0.0,2,0.99999950000025,Neutral
1430,brave starhopper carried the day,1,0,0.9999990000010001,4,0.24999993750001562,Most Positive
1431,only so many days,0,0,0.0,1,0.0,Neutral
1432,we were too obtuse for our own good although i think it works esthetically those are folded over c,2,1,0.33333322222225925,5,0.599999880000024,Positive
1433,but actually nothing was surprised to hear theyre across the road adding silicon to carbon anode,0,0,0.0,8,0.0,Neutral
1434,nothing u+f,0,0,0.0,1,0.0,Neutral
1435,then they leave the house and hardly ever call their parents,0,0,0.0,4,0.0,Neutral
