,Text_clean,positive_score,negative_score,polarity_score,number_words,subjectivity,Sentiment
0,im an alien,0,0,0.0,2,0.0,Neutral
1,ray tracing on cyberpunk with hdr is next level have you tried it,0,0,0.0,5,0.0,Neutral
2,great interview,1,0,0.9999990000010001,2,0.499999750000125,Most Positive
3,doge is underestimated,0,0,0.0,2,0.0,Neutral
4,congratulations tesla china for amazing execution last year now on to the next for even more,2,0,0.99999950000025,6,0.33333327777778704,Most Positive
5,happy new year of the ox,1,0,0.9999990000010001,3,0.33333322222225925,Most Positive
6,frodo was the underdogeall thought he would failhimself most of all,0,0,0.0,4,0.0,Neutral
7,haha thanks,0,0,0.0,1,0.0,Neutral
8,indeed tweets definitely do not represent real world time allocation,0,0,0.0,6,0.0,Neutral
9,the most entertaining outcome is the most likely,1,0,0.9999990000010001,2,0.499999750000125,Most Positive
10,just sent some,0,0,0.0,0,0.0,Neutral
11,just agree to do clubhouse with,0,0,0.0,2,0.0,Neutral
12,,0,0,0.0,0,0.0,Neutral
13,its getting real,0,0,0.0,1,0.0,Neutral
14,bought some dogecoin for lil x so he can be a toddler hodler,0,0,0.0,5,0.0,Neutral
15,he definitely has issues but the sentencing seems a bit high,0,1,-0.9999990000010001,4,0.24999993750001562,Most Negative
16,thanks for fixing,0,0,0.0,1,0.0,Neutral
17,please unlock my account,0,0,0.0,2,0.0,Neutral
18,u+fu+f,0,0,0.0,1,0.0,Neutral
19,this is true power haha,0,0,0.0,3,0.0,Neutral
20,any crypto wallet that wont give you your private keys should be avoided at all costs,0,0,0.0,8,0.0,Neutral
21,your app sucks,0,1,-0.9999990000010001,2,0.499999750000125,Most Negative
22, nasa has selected falcon heavy to launch the first two elements of the lunar gateway together on one mission,0,0,0.0,9,0.0,Neutral
23,yes,0,0,0.0,0,0.0,Neutral
24,once we can predict cash flow reasonably well starlink will ipo,2,0,0.99999950000025,5,0.399999920000016,Most Positive
25,starlink is a staggeringly difficult technical &amp economic endeavor however if we don,0,1,-0.9999990000010001,9,0.11111109876543349,Most Negative
26,spacex needs to pass through a deep chasm of negative cash flow over the next year or,0,1,-0.9999990000010001,8,0.12499998437500197,Most Negative
27,lowest cost per ton of carbon sequestered net of value of any product made must be scalable to g,0,0,0.0,9,0.0,Neutral
28,its meant to be the same price in all countries only difference should be taxes &amp shipping,0,0,0.0,8,0.0,Neutral
29,this is intended for earth but there may be some ideas that apply to mars too,0,0,0.0,5,0.0,Neutral
30,u+fu+f,0,0,0.0,1,0.0,Neutral
31,xprize team will manage the m carbon capture prize,1,0,0.9999990000010001,6,0.16666663888889352,Most Positive
32,everyone at tesla receives stock my comp is all stock options which i do not take off the table thats what youre missing,0,0,0.0,9,0.0,Neutral
33,back to work i go,1,0,0.9999990000010001,2,0.499999750000125,Most Positive
34,does seem a bit high,0,0,0.0,2,0.0,Neutral
35,doge appears to be inflationary but is not meaningfully so fixed of coins per unit time whereas,0,1,-0.9999990000010001,8,0.12499998437500197,Most Negative
36,wow,1,0,0.9999990000010001,1,0.9999990000010001,Most Positive
37, orbital launch tower that can stack enough raptors for orbit booster improve ship &amp booster mass,2,0,0.99999950000025,13,0.15384614201183525,Most Positive
38,back to work tonight,1,0,0.9999990000010001,3,0.33333322222225925,Most Positive
39,is for ogecoin instructional video,0,0,0.0,3,0.0,Neutral
40,the people have spoken,0,0,0.0,2,0.0,Neutral
41,so cute u+f,1,0,0.9999990000010001,2,0.499999750000125,Most Positive
42,extremely misleading image as doesnt reflect true time cost to people or rain &amp pain,0,2,-0.99999950000025,13,0.15384614201183525,Most Negative
43,u+fb who let the doge out u+fb,0,0,0.0,3,0.0,Neutral
44,hodl the rainforests,0,0,0.0,2,0.0,Neutral
45,so its finally come to this,0,0,0.0,1,0.0,Neutral
46,its the most fun crypto,1,0,0.9999990000010001,2,0.499999750000125,Most Positive
47,its simplicity is its genius,1,0,0.9999990000010001,2,0.499999750000125,Most Positive
48,yup,0,0,0.0,1,0.0,Neutral
49,u+fu+f,0,0,0.0,1,0.0,Neutral
50,true,0,0,0.0,1,0.0,Neutral
51,u+fu+f,0,0,0.0,1,0.0,Neutral
52,not that easy this is two decades of intense work have to look at old notes emails texts,2,1,0.33333322222225925,7,0.4285713673469475,Positive
53,yes,0,0,0.0,0,0.0,Neutral
54,lessons learned,0,0,0.0,2,0.0,Neutral
55,of earth and mars,0,0,0.0,2,0.0,Neutral
56,time to tell the story of tesla &amp spacex,0,0,0.0,6,0.0,Neutral
57,have you read  its great,1,0,0.9999990000010001,2,0.499999750000125,Most Positive
58,the second last kingdom,0,0,0.0,1,0.0,Neutral
59,havent heard that name in years,0,0,0.0,3,0.0,Neutral
60,dogecake,0,0,0.0,1,0.0,Neutral
61,yolt,0,0,0.0,1,0.0,Neutral
62,thats damian,0,0,0.0,1,0.0,Neutral
63,yeah,0,0,0.0,1,0.0,Neutral
64,sure,0,0,0.0,0,0.0,Neutral
65,the great thing about restaurants is that you get to hang out with strangers   sjm,1,1,0.0,6,0.33333327777778704,Neutral
66,the future currency of earth,0,0,0.0,3,0.0,Neutral
67,just a scratch,0,1,-0.9999990000010001,1,0.9999990000010001,Most Negative
68,much wow,1,0,0.9999990000010001,1,0.9999990000010001,Most Positive
69,u+fa,0,0,0.0,1,0.0,Neutral
70,destiny,1,0,0.9999990000010001,1,0.9999990000010001,Most Positive
71,franz was essential,0,0,0.0,2,0.0,Neutral
72,that said the ship landing burn has a clear solution my greate,1,1,0.0,6,0.33333327777778704,Neutral
73,will still use hot gas maneuvering rcs thrusters,1,0,0.9999990000010001,5,0.199999960000008,Most Positive
74,higher isp too,0,0,0.0,2,0.0,Neutral
75,intuitively it would seem so but turbopump fed raptors have mu,0,0,0.0,5,0.0,Neutral
76,yes,0,0,0.0,0,0.0,Neutral
77, falcon will launch spherex mission which will collect data on more than million galaxies and explore how the un,0,0,0.0,9,0.0,Neutral
78, falcon launches starlink satellites to orbit mission from pad a on deck,0,0,0.0,8,0.0,Neutral
79,its true,0,0,0.0,1,0.0,Neutral
80,yeah by default engine with least lever arm would shut down if all are good,1,0,0.9999990000010001,7,0.1428571224489825,Most Positive
81,yes but engines have a min throttle point where there is flameout risk so la,0,2,-0.99999950000025,7,0.285714244897965,Most Negative
82,yes,0,0,0.0,0,0.0,Neutral
83,it was foolish of us not to start engines &amp immediately shut down  as are needed to land,0,1,-0.9999990000010001,9,0.11111109876543349,Most Negative
84,i am become memedestroyer of shorts,0,0,0.0,2,0.0,Neutral
85,might actually happen,0,0,0.0,1,0.0,Neutral
86,sandstorm is a masterpiece,1,0,0.9999990000010001,2,0.499999750000125,Most Positive
87,we were too dumb,0,1,-0.9999990000010001,1,0.9999990000010001,Most Negative
88,next time we try pull *up* method,0,0,0.0,5,0.0,Neutral
89,low key loki,0,0,0.0,3,0.0,Neutral
90,no highs no lows only doge,0,0,0.0,3,0.0,Neutral
91,no need to be a gigachad to own,0,0,0.0,1,0.0,Neutral
92,dogecoin is the peoples crypto,0,0,0.0,3,0.0,Neutral
93,ur welcome,1,0,0.9999990000010001,1,0.9999990000010001,Most Positive
94,the most entertaining outcome is the most likely,1,0,0.9999990000010001,2,0.499999750000125,Most Positive
95,doge,0,0,0.0,1,0.0,Neutral
96,,0,0,0.0,0,0.0,Neutral
97,high seas &amp wind,0,0,0.0,5,0.0,Neutral
98,this was a tough one,1,0,0.9999990000010001,1,0.9999990000010001,Most Positive
99, watch falcon launch starlink satellites u+,0,0,0.0,6,0.0,Neutral
100,off twitter for a while,0,0,0.0,1,0.0,Neutral
101,it will be filled with graffiti art,0,0,0.0,3,0.0,Neutral
102,u+cu+b u+u+u+u+bu+u+u+c,0,0,0.0,2,0.0,Neutral
103,giga berlin progress,1,0,0.9999990000010001,3,0.33333322222225925,Most Positive
104,neuralink is working super hard to ensure implant safety &amp is in close communication with the,1,1,0.0,11,0.1818181652892577,Neutral
105, this mission enables access for everyday people who dream of going to space,0,0,0.0,7,0.0,Neutral
106, announcing the first commercial astronaut mission to orbit earth aboard dragon u+,0,0,0.0,9,0.0,Neutral
107,if youve worked on advanced wearables phones or robots those skills are needed,2,0,0.99999950000025,8,0.24999996875000394,Most Positive
108,feels weird helping make hopefully good version of cyberpunk come true,2,1,0.33333322222225925,8,0.3749999531250059,Positive
109,please consider working at neuralinkshort term solve brain spine injurieslong term human ai symbiosis latte,0,0,0.0,12,0.0,Neutral
110,,0,0,0.0,0,0.0,Neutral
111,on clubhouse tonight at pm la time,0,0,0.0,5,0.0,Neutral
112,tom has some great stories about experim,1,0,0.9999990000010001,4,0.24999993750001562,Most Positive
113, launch alert u+f and are targeting no earlier than april for the launch of the second crew rotation mis,0,0,0.0,10,0.0,Neutral
114,he became a big fan of methane but was,0,0,0.0,3,0.0,Neutral
115,that sounds correct tom certainly deserves a lot of cre,1,0,0.9999990000010001,6,0.16666663888889352,Most Positive
116,tom is great &amp was instrumental in developing early vers,2,0,0.99999950000025,8,0.24999996875000394,Most Positive
117,t w will be ~ so it will accelerate unusually fast high t w is important for reusable v,2,1,0.33333322222225925,7,0.4285713673469475,Positive
118,no escaping that for me,0,0,0.0,1,0.0,Neutral
119,read the whole article u+fu+f,0,0,0.0,3,0.0,Neutral
120,warm sunny day &amp snowy mountains,1,0,0.9999990000010001,7,0.1428571224489825,Most Positive
121,what a beautiful day in la,1,0,0.9999990000010001,3,0.33333322222225925,Most Positive
122,yeah dr frankensteen,0,0,0.0,3,0.0,Neutral
123,i never used this guy he gave a talk at spacex once,0,0,0.0,4,0.0,Neutral
124,only halo,0,0,0.0,1,0.0,Neutral
125,,0,0,0.0,0,0.0,Neutral
126,i sure hope thats not true at tesla or spacex,0,0,0.0,4,0.0,Neutral
127,cryoproof then install engines,0,0,0.0,3,0.0,Neutral
128,starship sn &amp sn,0,0,0.0,5,0.0,Neutral
129,in retrospect it was inevitable,0,1,-0.9999990000010001,2,0.499999750000125,Most Negative
130,great shot,1,0,0.9999990000010001,2,0.499999750000125,Most Positive
131,live by the sword die by the sword,0,1,-0.9999990000010001,4,0.24999993750001562,Most Negative
132,entropy,0,0,0.0,1,0.0,Neutral
133,buy &amp hold companies that make goods &amp produce services you love,1,0,0.9999990000010001,12,0.08333332638888948,Most Positive
134,earth is small &amp we are smaller still,0,0,0.0,5,0.0,Neutral
135,u+f,0,0,0.0,1,0.0,Neutral
136,with cyberpunk even the hotfixes literally have hotfixes but great game,1,0,0.9999990000010001,6,0.16666663888889352,Most Positive
137,,0,0,0.0,0,0.0,Neutral
138,the dollar is shorting itself,0,0,0.0,2,0.0,Neutral
139,indeed,0,0,0.0,0,0.0,Neutral
140,shopify is great too spacex used them,1,0,0.9999990000010001,3,0.33333322222225925,Most Positive
141,u+fu+f,0,0,0.0,1,0.0,Neutral
142,indeed the economy making useful products &amp providing great services is what actually matters,2,0,0.99999950000025,9,0.22222219753086697,Most Positive
143,tanstaafl would be better to have small fees than no fees as latter makes robin,1,0,0.9999990000010001,6,0.16666663888889352,Most Positive
144,here come the shorty apologistsgive them no respectget shorty,0,0,0.0,4,0.0,Neutral
145,u cant sell houses u dont ownu cant sell cars u dont ownbut u *can* sell stock u dont ownthis is bs sh,0,1,-0.9999990000010001,16,0.06249999609375024,Most Negative
146,yes,0,0,0.0,0,0.0,Neutral
147,finishing engineering this year production starts next year aiming to have release candidate desig,0,0,0.0,10,0.0,Neutral
148,i made that video,0,0,0.0,2,0.0,Neutral
149,absolutely,0,0,0.0,1,0.0,Neutral
150,unlike its aircraft division which is fine the faa space division has a fundamentally broken reg,1,1,0.0,10,0.19999998000000202,Neutral
151,nomad,0,0,0.0,1,0.0,Neutral
152,u+f,0,0,0.0,1,0.0,Neutral
153,the esthetics of cyberpunk are incredible btw the interior design isu+fc,1,0,0.9999990000010001,7,0.1428571224489825,Most Positive
154,major esthetics improvements coming,1,0,0.9999990000010001,4,0.24999993750001562,Most Positive
155,a little,0,0,0.0,0,0.0,Neutral
156,new roadster is part rocket,0,0,0.0,3,0.0,Neutral
157,theres more storage now &amp easily upgradable,1,0,0.9999990000010001,5,0.199999960000008,Most Positive
158,,0,0,0.0,0,0.0,Neutral
159,yes,0,0,0.0,0,0.0,Neutral
160,yeah probably in a few months,0,0,0.0,2,0.0,Neutral
161,after you drive without using a prnd stalk stick for a few days it gets very annoying to go back &amp use a shifter,0,1,-0.9999990000010001,10,0.09999999000000101,Most Negative
162,no more stalks car guesses drive direction based on what obstacles it sees context &amp nav map you,0,0,0.0,13,0.0,Neutral
163,a hedge fund that shorts is a shrubbery,0,1,-0.9999990000010001,4,0.24999993750001562,Most Negative
164,,0,0,0.0,0,0.0,Neutral
165,yeah also a rear screen,0,0,0.0,3,0.0,Neutral
166,to mph trap speed in a   mile mph top speed with right tires,2,1,0.33333322222225925,8,0.3749999531250059,Positive
167,first production car ever to achieve to mph in less than seconds,0,0,0.0,5,0.0,Neutral
168,it can play cyberpunk,0,0,0.0,2,0.0,Neutral
169,plaid model s ships next month,0,0,0.0,4,0.0,Neutral
170,even discord has gone corpo,0,1,-0.9999990000010001,2,0.499999750000125,Most Negative
171,yup wild times on discord haha,0,2,-0.99999950000025,5,0.399999920000016,Most Negative
172,,0,0,0.0,0,0.0,Neutral
173,waiting for faa review,0,0,0.0,3,0.0,Neutral
174,gamestonk,0,0,0.0,1,0.0,Neutral
175,passed initial pressure test,0,0,0.0,4,0.0,Neutral
176,yes,0,0,0.0,0,0.0,Neutral
177,,0,0,0.0,0,0.0,Neutral
178,bought a hand knit wool marvin the martian helm for my dog,0,0,0.0,8,0.0,Neutral
179,,0,0,0.0,0,0.0,Neutral
180,i kinda love etsy,1,0,0.9999990000010001,3,0.33333322222225925,Most Positive
181,it does not serve the public to hamstring starlink today for an amazon satellite system that is at,0,0,0.0,8,0.0,Neutral
182,were hoping for faa approval of a test flight tomorrow afternoon,1,0,0.9999990000010001,7,0.1428571224489825,Most Positive
183,the entire stack from data collection through labeling &amp inference has to be in surround video th,0,0,0.0,10,0.0,Neutral
184,yes although it will be crazy not to turn on fsd,0,1,-0.9999990000010001,3,0.33333322222225925,Most Negative
185,tesla is steadily moving all nns to camera surround video this will enable superhuman self driving,0,0,0.0,10,0.0,Neutral
186,some tyranny also the road to hell is mostly paved with bad intentions,0,3,-0.9999996666667778,6,0.49999991666668053,Most Negative
187,catchy,1,0,0.9999990000010001,1,0.9999990000010001,Most Positive
188,all sats launched next year will have laser links only o,0,0,0.0,5,0.0,Neutral
189,yup,0,0,0.0,1,0.0,Neutral
190,i hope so,0,0,0.0,1,0.0,Neutral
191,these also have laser links between the satellites so no ground stations are needed over the poles,0,0,0.0,7,0.0,Neutral
192,sorry for the version confusion v is what it should say for fsd separate version number for rest of car,0,2,-0.99999950000025,8,0.24999996875000394,Most Negative
193,to my surprise tesla has better ai hardware &amp software than waymo money,1,0,0.9999990000010001,9,0.11111109876543349,Most Positive
194,it floats,0,0,0.0,1,0.0,Neutral
195,fallout themed opening party for vegas loop happening as soon as allowed,0,1,-0.9999990000010001,8,0.12499998437500197,Most Negative
196,u+fu+f,0,0,0.0,1,0.0,Neutral
197,under vegas in tunnel yesterday with my boys,0,0,0.0,4,0.0,Neutral
198,lasers,0,0,0.0,1,0.0,Neutral
199, spacexs rideshare offering provides increased access to space for small satellite operators seeking a reliable affordable rid,2,0,0.99999950000025,13,0.15384614201183525,Most Positive
200, falcon s first stage has landed on the of course i still love you droneship,1,0,0.9999990000010001,5,0.199999960000008,Most Positive
201, liftoff,0,0,0.0,1,0.0,Neutral
202,u+faf,0,0,0.0,1,0.0,Neutral
203,were switching to a more sensible fsd version numbering to distinguish between major &amp minor updates,1,0,0.9999990000010001,10,0.09999999000000101,Most Positive
204,hopefully early next week,0,0,0.0,2,0.0,Neutral
205, due to unfavorable weather we are standing down from todays launch the team will continue with the countdown until t  seco,0,1,-0.9999990000010001,10,0.09999999000000101,Most Negative
206,given so many other companies are depending on this mission it is getting even more scru,0,0,0.0,4,0.0,Neutral
207,launching many small satellites for a wide range of customers tomorrow excited about offering low cost access to o,1,0,0.9999990000010001,12,0.08333332638888948,Most Positive
208,they are part of the solution but require lots of fresh water &amp land we may need something thats,1,0,0.9999990000010001,9,0.11111109876543349,Most Positive
209,sn,0,0,0.0,1,0.0,Neutral
210,its a good path for fully renewable rocket energy so solves part of problem but longer chain hyd,1,1,0.0,12,0.16666665277777895,Neutral
211,details next week,0,0,0.0,2,0.0,Neutral
212,am donating m towards a prize for best carbon capture technology,2,0,0.99999950000025,5,0.399999920000016,Most Positive
213,pretty much,1,0,0.9999990000010001,1,0.9999990000010001,Most Positive
214,that would probably mean civilization is doing gr,0,0,0.0,2,0.0,Neutral
215,,0,0,0.0,0,0.0,Neutral
216,absolutely they rock u+fa,0,0,0.0,3,0.0,Neutral
217, falcon launches starlink to orbit the eighth launch and landing of this booster,0,0,0.0,8,0.0,Neutral
218,the rate limiting part or process in cell production is constantly changing,0,0,0.0,8,0.0,Neutral
219,cars &amp trucks stuck in traffic generate megatons of toxic gases &amp particulate but,0,2,-0.99999950000025,13,0.15384614201183525,Most Negative
220,with our giant casting machines we are literally trying to make full size car,0,0,0.0,8,0.0,Neutral
221,tegmark is an exceptionally smart &amp good human,3,0,0.9999996666667778,7,0.4285713673469475,Most Positive
222,the best manufacturing technology is in ultra high volume industries like food &amp beverage some medical eg syringes &amp toys,2,0,0.99999950000025,15,0.13333332444444504,Most Positive
223,battery cell production is the fundamental rate limiter slowing down a sustainable energy future very important pr,2,0,0.99999950000025,12,0.16666665277777895,Most Positive
224,looking into this no question that fsd should be viewed as reasonably valuable when doing a trade in,2,0,0.99999950000025,5,0.399999920000016,Most Positive
225,for sure,0,0,0.0,0,0.0,Neutral
226,glad youre ok,1,0,0.9999990000010001,2,0.499999750000125,Most Positive
227,congratulations,1,0,0.9999990000010001,1,0.9999990000010001,Most Positive
228,this is a good one,1,0,0.9999990000010001,1,0.9999990000010001,Most Positive
229,i whistle,0,0,0.0,1,0.0,Neutral
230,cybertruck doesnt need a garage,0,0,0.0,3,0.0,Neutral
231,it will be awesome,1,0,0.9999990000010001,1,0.9999990000010001,Most Positive
232,good point,1,0,0.9999990000010001,2,0.499999750000125,Most Positive
233,your server side code is doing too much,0,0,0.0,3,0.0,Neutral
234,happy birthday wikipedia so glad you exist,2,0,0.99999950000025,5,0.399999920000016,Most Positive
235,guess you been watching cobra kai,0,0,0.0,4,0.0,Neutral
236,fallout new texas,0,1,-0.9999990000010001,2,0.499999750000125,Most Negative
237,only chuck norris can divide by zero,0,0,0.0,3,0.0,Neutral
238,good point,1,0,0.9999990000010001,2,0.499999750000125,Most Positive
239,the thing we call money is just an information system for labor allocation what actuall,0,0,0.0,8,0.0,Neutral
240,monty python is amazing,1,0,0.9999990000010001,3,0.33333322222225925,Most Positive
241,they sure can twist the knife in that show,0,2,-0.99999950000025,3,0.6666664444445185,Most Negative
242,probably wise,1,0,0.9999990000010001,1,0.9999990000010001,Most Positive
243,were making major improvements to ease of engine swap needs to be a few hours at most,2,0,0.99999950000025,7,0.285714244897965,Most Positive
244,two of the engines need slight repairs so will be switched out,0,0,0.0,4,0.0,Neutral
245,nice shot,1,0,0.9999990000010001,2,0.499999750000125,Most Positive
246,we dont have high school internships but please apply when youre in college,0,0,0.0,7,0.0,Neutral
247,prototypes are easy volume production is hard positive cash flow is excruciating,2,2,0.0,9,0.44444439506173394,Neutral
248,physics,0,0,0.0,1,0.0,Neutral
249, splashdown of dragon confirmed completing spacexs st resupply mission and the first return of a cargo resupp,0,0,0.0,11,0.0,Neutral
250,detanking &amp inspections now good progress towards our hop in &amp go to mars goal,2,0,0.99999950000025,11,0.1818181652892577,Most Positive
251,all three static fires completed &amp no ruds,0,1,-0.9999990000010001,6,0.16666663888889352,Most Negative
252,wow a lot has happened in years,1,0,0.9999990000010001,4,0.24999993750001562,Most Positive
253,fair enough haha,2,0,0.99999950000025,2,0.99999950000025,Most Positive
254,,0,0,0.0,0,0.0,Neutral
255,sea shanty tiktok takes it to a new level with actual pirate ships,0,0,0.0,8,0.0,Neutral
256,sure,0,0,0.0,0,0.0,Neutral
257,today at spacex is about practicing starship engine starts ship is held down by massive pins while engines are fir,0,0,0.0,12,0.0,Neutral
258,as promised,1,0,0.9999990000010001,1,0.9999990000010001,Most Positive
259,legalize comedy,0,0,0.0,2,0.0,Neutral
260,you can steal our name logos &amp we probably wont sue you,0,2,-0.99999950000025,6,0.33333327777778704,Most Negative
261,were just trying to get people to mars help would be appreciated,1,0,0.9999990000010001,3,0.33333322222225925,Most Positive
262,one day we will get a camera up there that also shows the star field in the background,0,0,0.0,6,0.0,Neutral
263, separation confirmed dragon performing departure burns to move away from the,0,1,-0.9999990000010001,7,0.1428571224489825,Most Negative
264,suicide is more than double homicide,0,1,-0.9999990000010001,3,0.33333322222225925,Most Negative
265,absolutely,0,0,0.0,1,0.0,Neutral
266,hey you yeah you queen youre gonna make it u+fu+f,0,0,0.0,8,0.0,Neutral
267,hate to say it but might be true,0,1,-0.9999990000010001,2,0.499999750000125,Most Negative
268,the robot future is coming,0,0,0.0,3,0.0,Neutral
269,km every millisecond but there are times i wish it were faster,1,0,0.9999990000010001,4,0.24999993750001562,Most Positive
270,,0,0,0.0,0,0.0,Neutral
271,,0,0,0.0,0,0.0,Neutral
272,mus protec u+f yoda,0,0,0.0,4,0.0,Neutral
273,u+eu+d u+u+bu+b u+u+u+bu+u+au+eu+bu+u+fu+u+d,0,0,0.0,3,0.0,Neutral
274,this is an important distinction,2,0,0.99999950000025,2,0.99999950000025,Most Positive
275,much more than this &amp increasing rapidly,0,0,0.0,4,0.0,Neutral
276,it is,0,0,0.0,0,0.0,Neutral
277,once in a while something happens that is even better than we imagined,1,0,0.9999990000010001,1,0.9999990000010001,Most Positive
278,the factory is the product,0,0,0.0,2,0.0,Neutral
279,probably commenting on will do more,0,0,0.0,1,0.0,Neutral
280,i bought the replacement glass from a junkyard for  theyre great places to get spare parts,1,1,0.0,9,0.22222219753086697,Neutral
281,a lot of people are going to be super unhappy with west coast high tech as the de facto arbiter of free speech,2,1,0.33333322222225925,13,0.23076921301775286,Positive
282,already donated to signal a year ago will donate more,0,0,0.0,5,0.0,Neutral
283,i am primarily trying to advance two causes sustainable energy &amp extending life consciousness beyond e,1,0,0.9999990000010001,9,0.11111109876543349,Most Positive
284,u+fu+f,0,0,0.0,1,0.0,Neutral
285,maybe a tesla ai day later this year,0,0,0.0,4,0.0,Neutral
286,the prancing pony,0,0,0.0,2,0.0,Neutral
287,u+fu+f,0,0,0.0,1,0.0,Neutral
288,u+f,0,0,0.0,1,0.0,Neutral
289,its true,0,0,0.0,1,0.0,Neutral
290,yes but not for long,0,0,0.0,1,0.0,Neutral
291,yeah they seemed optimistic too,1,0,0.9999990000010001,2,0.499999750000125,Most Positive
292,my  year old son saxon said he feels like will be a good year i agree let us all make it so,2,0,0.99999950000025,8,0.24999996875000394,Most Positive
293,was also thinking that spacex boca should hold fun parties and give tours for the community from time to time,1,0,0.9999990000010001,11,0.09090908264462885,Most Positive
294,i super support public spaces around our production &amp launch sites wherever it can be done,2,0,0.99999950000025,9,0.22222219753086697,Most Positive
295,that too,0,0,0.0,0,0.0,Neutral
296,catapult high into the air &amp land on the roof with a base jumping parachute the only way to travel,0,0,0.0,11,0.0,Neutral
297,thats actually our restaurant but spacex is building a futuristic bar at the top of the h,2,0,0.99999950000025,6,0.33333327777778704,Most Positive
298,and increase fun hopefully,1,0,0.9999990000010001,2,0.499999750000125,Most Positive
299,me neither,0,0,0.0,0,0.0,Neutral
300,one of the best tesla solar roof installations,1,0,0.9999990000010001,4,0.24999993750001562,Most Positive
301,no but maybe one day,0,0,0.0,1,0.0,Neutral
302,yes that would be the best way to do it a large solar field or reactor is needed for po,1,0,0.9999990000010001,6,0.16666663888889352,Most Positive
303,his sick beats,0,1,-0.9999990000010001,2,0.499999750000125,Most Negative
304,probably less than a few dozen primary decision makers technically only three,0,0,0.0,5,0.0,Neutral
305,or at least the option for verification so that the public can ascribe more credibilit,0,0,0.0,5,0.0,Neutral
306,launch underway,0,0,0.0,2,0.0,Neutral
307,btw critical feedback is always super appreciated as well as ways to donate money that really make a difference way harder than it seems,3,1,0.49999987500003124,11,0.3636363305785154,Positive
308,yup,0,0,0.0,1,0.0,Neutral
309,indirectly an electric rocket is possible by using electricity to convert co+ho &gt ch+o this,0,0,0.0,9,0.0,Neutral
310,not to get to orbit unfortunately in space photon emission powered by matter antimatter annihila,0,1,-0.9999990000010001,8,0.12499998437500197,Most Negative
311,this will be hard to make as it isnt like any other vehicle,1,1,0.0,4,0.49999987500003124,Neutral
