,Text_clean,positive_score,negative_score,polarity_score,number_words,subjectivity,Sentiment
609,this is a misperception spacex developed &amp continues to use lidar for dragon docking with,0,0,0.0,9,0.0,Neutral
610,one day we will fly you on starship,0,0,0.0,3,0.0,Neutral
611,well done,1,0,0.9999990000010001,0,1000000.0,Most Positive
612,i cant comment on turbopump internal details but youre roughly in the ballpark wow roc,1,0,0.9999990000010001,9,0.11111109876543349,Most Positive
613,to be clear this was just an xpeng problem other companies in china have not done this,1,1,0.0,5,0.399999920000016,Neutral
614,andrej is awesome but it should be said that we have a very talented autopilot,2,0,0.99999950000025,4,0.49999987500003124,Most Positive
615,yeah they stole apples code too,0,1,-0.9999990000010001,4,0.24999993750001562,Most Negative
616,they have an old version of our software &amp dont have our nn inference computer,0,0,0.0,8,0.0,Neutral
617,wild times,0,1,-0.9999990000010001,2,0.499999750000125,Most Negative
618,congrats,0,0,0.0,1,0.0,Neutral
619,,0,0,0.0,0,0.0,Neutral
620,yup,0,0,0.0,1,0.0,Neutral
621,change out a few parts otherwise fine,1,0,0.9999990000010001,3,0.33333322222225925,Most Positive
622,caution strongly advised with spacs,0,0,0.0,4,0.0,Neutral
623,sure,0,0,0.0,0,0.0,Neutral
624,haha sexy cropping champion of all time,2,0,0.99999950000025,5,0.399999920000016,Most Positive
625,if next weeks release looks good we will widen beta,1,0,0.9999990000010001,5,0.199999960000008,Most Positive
626,unfortunately there are too many rules around liquor distribution even in the us,0,1,-0.9999990000010001,3,0.33333322222225925,Most Negative
627,next weeks release is special lot of fundamental improvements both important bug fixes &amp entire n,2,1,0.33333322222225925,12,0.2499999791666684,Positive
628,years &amp  billion wow,1,0,0.9999990000010001,5,0.199999960000008,Most Positive
629,safety is our primary design goal,0,0,0.0,4,0.0,Neutral
630,fully,0,0,0.0,1,0.0,Neutral
631,let the martians decide their own future,0,0,0.0,3,0.0,Neutral
632,a lot of my brain space is spent dealing with both units,0,0,0.0,6,0.0,Neutral
633,terraforming will be too slow to be relevant in our lifetime however we can establish a human base,0,1,-0.9999990000010001,7,0.1428571224489825,Most Negative
634,that is certainly the intention,0,0,0.0,1,0.0,Neutral
635,,0,0,0.0,0,0.0,Neutral
636,the only publicly traded stock i own is tesla,0,0,0.0,4,0.0,Neutral
637,wise words from bogle the point of companies is products &amp services they have no point in &amp of thems,1,0,0.9999990000010001,13,0.07692307100591762,Most Positive
638,no just a mild cold same with my bro def had cov though pc&lt means viral,0,1,-0.9999990000010001,10,0.09999999000000101,Most Negative
639,life in glass domes at first eventually terraformed to support life like earth,2,0,0.99999950000025,8,0.24999996875000394,Most Positive
640,yeah,0,0,0.0,1,0.0,Neutral
641,i was going to say sim but that seemed too obvious haha,0,0,0.0,3,0.0,Neutral
642,deveras,0,0,0.0,1,0.0,Neutral
643,and cases with high non infectious ct should quarantine for a few days while getting another test seco,0,0,0.0,8,0.0,Neutral
644,so many things you want &amp some you didnt know you wanted,0,0,0.0,5,0.0,Neutral
645,maybe a little mercy,1,0,0.9999990000010001,1,0.9999990000010001,Most Positive
646,tesla holiday software release is u+fu+f,0,0,0.0,5,0.0,Neutral
647,u+ff,0,0,0.0,1,0.0,Neutral
648,cobra kai is a deep cut,0,0,0.0,4,0.0,Neutral
649,its all cake &amp someone took a bite,0,0,0.0,4,0.0,Neutral
650,there is such a thing as too much sentience,0,0,0.0,2,0.0,Neutral
651,deus ex machine learning,0,0,0.0,3,0.0,Neutral
652,its designed to make life multiplanetary otherwise extreme overkill for mere earth sector activity,0,1,-0.9999990000010001,10,0.09999999000000101,Most Negative
653,more like he gave it his blessing it was sort of a groundswell of those who believed,2,0,0.99999950000025,5,0.399999920000016,Most Positive
654,nullius in verba,0,0,0.0,2,0.0,Neutral
655,indeed,0,0,0.0,0,0.0,Neutral
656,dojo doge,0,0,0.0,2,0.0,Neutral
657,yeah looks like marginal cost of launch will be less than m for more than,1,1,0.0,4,0.49999987500003124,Neutral
658,exactly,0,0,0.0,0,0.0,Neutral
659,merlin is a strong local maximum design but kerosene is suboptimal fuel no matter what,1,0,0.9999990000010001,9,0.11111109876543349,Most Positive
660,yes but from a visiting american ah the irony is just too much,0,1,-0.9999990000010001,4,0.24999993750001562,Most Negative
661,yeah pcr ct was unequivocal at &lt doesnt matter what m,1,0,0.9999990000010001,8,0.12499998437500197,Most Positive
662,maybe making some notable changes will wait until figurative &amp literal dust settles,0,1,-0.9999990000010001,9,0.11111109876543349,Most Negative
663,pretty close definitely feel u+faf if i take dayquil frankly this was one,1,0,0.9999990000010001,6,0.16666663888889352,Most Positive
664,avionics cables moving to steel pipe shields &amp adding water cooled steel pipes to test pad,0,0,0.0,15,0.0,Neutral
665,about secs after starting engines martyte covering concrete below shattered sending blades of,0,0,0.0,9,0.0,Neutral
666,the most amazing thing about rocket engines is that they *sometimes* dont blow up the,1,1,0.0,8,0.24999996875000394,Neutral
667,we should just count the atoms at this point,0,0,0.0,3,0.0,Neutral
668,absolutely production testing of rocket engines is over  of,0,0,0.0,5,0.0,Neutral
669,our first merlin engine design was really bad tbh nothing worked well,2,1,0.33333322222225925,6,0.49999991666668053,Positive
670,maybe *i* just love irony haha,1,1,0.0,5,0.399999920000016,Neutral
671,theyre on their way hopefully more teslaquila next month,0,0,0.0,3,0.0,Neutral
672,special permission received from stonecutters guild,0,0,0.0,5,0.0,Neutral
673,fate u+fa irony,0,1,-0.9999990000010001,3,0.33333322222225925,Most Negative
674,well said,1,0,0.9999990000010001,0,1000000.0,Most Positive
675,u+fb u+fb,0,0,0.0,2,0.0,Neutral
676,damn thats not easy i spent quite a bit of time looking at russian ukrainian engines theyre good,2,1,0.33333322222225925,10,0.299999970000003,Positive
677,yes,0,0,0.0,0,0.0,Neutral
678, docking confirmed crew dragon has arrived at the ,0,0,0.0,5,0.0,Neutral
679,u+fb toss a bitcoin to ur witcher u+fb,0,0,0.0,6,0.0,Neutral
680,u+f,0,0,0.0,1,0.0,Neutral
681, u+f enter the crew dragon at  pm est  pm utc the nasa crew  astronauts give you a live tour of their space,0,0,0.0,15,0.0,Neutral
682,curevac moderna &amp a few others tesla makes the machine curevac uses to go from kn,0,0,0.0,9,0.0,Neutral
683,creating synthetic mrna for cures vaccines is the future of medicine imo turns it mostly into a,0,0,0.0,9,0.0,Neutral
684,haha,0,0,0.0,1,0.0,Neutral
685,great thread,1,0,0.9999990000010001,2,0.499999750000125,Most Positive
686,im ok thanks for asking no symptoms for past few days apart from fatigue unless something chang,0,2,-0.99999950000025,6,0.33333327777778704,Most Negative
687,u+u+fef,0,0,0.0,1,0.0,Neutral
688,launch in minutes,0,0,0.0,2,0.0,Neutral
689,yeah with cooling channels integrated into the chamber walls,1,0,0.9999990000010001,6,0.16666663888889352,Most Positive
690,the same propellant is used either for abort or for orbital maneuvering as one use obviates the other,0,1,-0.9999990000010001,5,0.199999960000008,Most Negative
691,dragon can also hover &amp land propulsively but we use the parachutes for maximum safety,0,0,0.0,9,0.0,Neutral
692,thrusters are integrated with spacecraft enabling abort capability all the way to abort for increased safety,2,2,0.0,9,0.44444439506173394,Neutral
693, what song would you play on your ride out to the launch pad,0,0,0.0,5,0.0,Neutral
694, dragon has completed flights to and from the  it was designed from the beginning with human spaceflight in mi,0,0,0.0,8,0.0,Neutral
695, dragon is the only spacecraft currently flying capable of returning significant amounts of cargo to earth and is the first priv,2,0,0.99999950000025,10,0.19999998000000202,Most Positive
696, spacexs custom tailored suits route the communications and cooling systems and protect the crew in the event of cabin depressu,1,0,0.9999990000010001,13,0.07692307100591762,Most Positive
697, live now we are ready to  are you u+fwatch coverage of the nasa crew  mission liftoff is at pm et,1,0,0.9999990000010001,9,0.11111109876543349,Most Positive
698, watch falcon launch crew dragon on its first operational mission to the with astronauts on board u+,0,0,0.0,10,0.0,Neutral
699,ok,0,0,0.0,0,0.0,Neutral
700, all systems are go for tonights launch at  pm est of crew dragons first operational mission with four astronauts on boa,0,0,0.0,11,0.0,Neutral
701,yeah i feel pretty normal no symptoms right now last week i had sym,2,1,0.33333322222225925,7,0.4285713673469475,Positive
702,doing tests from several different labs same time of day administered by rn &amp am,0,0,0.0,8,0.0,Neutral
703,both obv insanely great too bad they had this pointless argument,1,3,-0.49999987500003124,6,0.6666665555555741,Negative
704,astronaut launch today,0,0,0.0,3,0.0,Neutral
705, u+f has a message for boys and girls in japan space is waiting in this spotlight astronaut so,0,0,0.0,9,0.0,Neutral
706, this weeku+f nasas crew  astronauts arrive at ahead of launchu+f our rover marks days,0,0,0.0,10,0.0,Neutral
707, just finished final dress rehearsal getting ready for saturday launch behind me is real,1,0,0.9999990000010001,8,0.12499998437500197,Most Positive
708,no kids though,0,0,0.0,1,0.0,Neutral
709,hell of a wig collection too,0,1,-0.9999990000010001,3,0.33333322222225925,Most Negative
710,it would be great if labs could give people this level of granular feedback in their results,1,0,0.9999990000010001,8,0.12499998437500197,Most Positive
711, great question its more complex question and depends on why the test is being used   ie do you want to kn,1,1,0.0,7,0.285714244897965,Neutral
712,worth reading this thread if youre curious about rona testing,1,0,0.9999990000010001,7,0.1428571224489825,Most Positive
713,they should be imo if you get a blood pressure test they tell you the number not ju,0,0,0.0,6,0.0,Neutral
714,a little up &amp down feels just like a regular cold but more body achy &amp cloudy head than co,1,2,-0.33333322222225925,11,0.2727272479338866,Negative
715,in your opinion at what ct number for the cov n gene should a pcr test probably be regarded as,0,0,0.0,8,0.0,Neutral
716,,0,0,0.0,0,0.0,Neutral
717,cool but please be super cautious expect two steps forward one back lot of new code was merged,2,0,0.99999950000025,10,0.19999998000000202,Most Positive
718,just a scratch we can buff it out,0,1,-0.9999990000010001,2,0.499999750000125,Most Negative
719,am getting wildly different results from different labs but most likely i have a moderate case of covid,0,1,-0.9999990000010001,6,0.16666663888889352,Most Negative
720,npcs all the way up,0,0,0.0,1,0.0,Neutral
721,ahem,0,0,0.0,1,0.0,Neutral
722,unless youre on dmt,0,0,0.0,2,0.0,Neutral
723,laws of thermodynamics you cant win you cant break even you cant stop playing,1,1,0.0,6,0.33333327777778704,Neutral
724,shakes fist at entropy,0,1,-0.9999990000010001,3,0.33333322222225925,Most Negative
725,big expansion of beta program in to weeks,0,0,0.0,5,0.0,Neutral
726,interesting my thursday night saliva sample came back today with n gene unique to cov,1,0,0.9999990000010001,10,0.09999999000000101,Most Positive
727,whats honey,0,0,0.0,2,0.0,Neutral
728,feels that way,0,0,0.0,1,0.0,Neutral
729,this seems accurate,1,0,0.9999990000010001,1,0.9999990000010001,Most Positive
730,cold symptoms are gone for now u+fu+fu+fab,0,2,-0.99999950000025,3,0.6666664444445185,Most Negative
731,there are degrees of pos,0,0,0.0,2,0.0,Neutral
732,heneghan makes a lot of sense hilarious that he has to clarify that he r,1,0,0.9999990000010001,6,0.16666663888889352,Most Positive
733,the number of pcr amplification cycles required to detect the virus is a rough indicator of your vir,0,2,-0.99999950000025,10,0.19999998000000202,Most Negative
734,this a great reference worth a read,2,0,0.99999950000025,4,0.49999987500003124,Most Positive
735,case closed,0,0,0.0,2,0.0,Neutral
736,soon,0,0,0.0,0,0.0,Neutral
737,fwiw lab i just spoke to thinks below is accurate to gets dicey &amp above is bs will talk to,1,1,0.0,10,0.19999998000000202,Neutral
738,lab i just spoke to said cov pcr detection n &amp n genes below cycles is reliable &amp above cycles is not,1,0,0.9999990000010001,13,0.07692307100591762,Most Positive
739,note this is not the spike protein they dont consider that reliable,1,0,0.9999990000010001,5,0.199999960000008,Most Positive
740,just spoke directly to a testing lab their main pcr search is for the n gene unique,0,0,0.0,9,0.0,Neutral
741,strange,0,1,-0.9999990000010001,1,0.9999990000010001,Most Negative
742,possible explanation for the dramatic decline in cold &amp flu prevalence vs prior years if someone comes,0,2,-0.99999950000025,10,0.19999998000000202,Most Negative
743,moreover lower the true prevalence the higher the false positive number will be this sounds obvious,1,1,0.0,9,0.22222219753086697,Neutral
744,from,0,0,0.0,0,0.0,Neutral
745,sure is,0,0,0.0,0,0.0,Neutral
746,would be great to hear from people who know a lot about the pcr testing industry whats the approximate false posi,1,1,0.0,11,0.1818181652892577,Neutral
747,interesting,1,0,0.9999990000010001,1,0.9999990000010001,Most Positive
748,interesting,1,0,0.9999990000010001,1,0.9999990000010001,Most Positive
749,what is the general population no knowledge of symptoms accuracy of a sars cov pcr test &amp is it possible to gene,0,1,-0.9999990000010001,12,0.08333332638888948,Most Negative
750,a good pcr test should identify if i have the cov spike proteins although i have heard s,1,0,0.9999990000010001,8,0.12499998437500197,Most Positive
751,mild sniffles &amp cough &amp slight fever past few days right now no symptoms although i did take nyquil,1,2,-0.33333322222225925,13,0.23076921301775286,Negative
752,technically i tested positive then negative twice then positive again so elon musk tests negati,2,1,0.33333322222225925,9,0.33333329629630043,Positive
753,the carousel turns ever faster,1,0,0.9999990000010001,3,0.33333322222225925,Most Positive
754,yup,0,0,0.0,1,0.0,Neutral
755,exactly,0,0,0.0,0,0.0,Neutral
756,symptoms of a typical cold nothing unusual so far,0,3,-0.9999996666667778,4,0.7499998125000469,Most Negative
757,if its happening to me its happening to others im getting pcr tests from separate labs results will take about hours,0,0,0.0,9,0.0,Neutral
758,something extremely bogus is going on was tested for covid four times today two tests came back negative two cam,0,2,-0.99999950000025,10,0.19999998000000202,Most Negative
759,burst disk worked so vehicle appears to be ok well have to swap out at least one of the engines,2,0,0.99999950000025,7,0.285714244897965,Most Positive
760,maybe melted an engine preburner or fuel hot gas manifold whatev,1,0,0.9999990000010001,8,0.12499998437500197,Most Positive
761,we lost vehicle pneumatics reason unknown at present liquid oxygen header tank pressure is risin,0,3,-0.9999996666667778,12,0.2499999791666684,Most Negative
762,u+fu+fu+fd,0,0,0.0,1,0.0,Neutral
763, tesla tops list of s most attractive employers for us engineering students,2,0,0.99999950000025,7,0.285714244897965,Most Positive
764,astronauts fly to on sat night from cape first operational flight of crew dragon,0,0,0.0,9,0.0,Neutral
765,luck is the best superpower,2,0,0.99999950000025,2,0.99999950000025,Most Positive
766, thank you to all those who have served and sacrificed,1,1,0.0,2,0.99999950000025,Neutral
767, crew access arm swings into place,0,0,0.0,5,0.0,Neutral
768,yes,0,0,0.0,0,0.0,Neutral
769,it is an honor that they would choose to work with me i strive to ensure that the companies enable,2,0,0.99999950000025,7,0.285714244897965,Most Positive
770,such a privilege to work with people i like &amp respect so much i feel blessed,4,0,0.9999997500000625,8,0.4999999375000079,Most Positive
771, the flight readiness review for the crew  mission to the has concluded and and are go t,0,0,0.0,6,0.0,Neutral
772, falcon and crew dragon vertical on launch complex a,0,1,-0.9999990000010001,6,0.16666663888889352,Most Negative
773,probably,0,0,0.0,0,0.0,Neutral
774,happy to see this,1,0,0.9999990000010001,1,0.9999990000010001,Most Positive
775,i do expect this to become an important product for the world but probably not financially material for tesla,1,0,0.9999990000010001,7,0.1428571224489825,Most Positive
776,theres no entry,0,0,0.0,1,0.0,Neutral
777,tesla makes the rna bioreactor that can make vaccines   cures curevac has version in use,0,0,0.0,9,0.0,Neutral
778, crew dragon and falcon in the hangar at launch complex a ahead of launching four astronauts to the  liftoff,0,1,-0.9999990000010001,10,0.09999999000000101,Most Negative
779,checking,0,0,0.0,1,0.0,Neutral
780,i just hope this game doesnt twist itself to tedium out of fear of being canceled,0,2,-0.99999950000025,7,0.285714244897965,Most Negative
781, rumor has it that austin chalk is geologically one of best soils for tunneling want to find out austin jobs now avai,1,1,0.0,10,0.19999998000000202,Neutral
782,,0,0,0.0,0,0.0,Neutral
783,yes you can have my damn cookie should be a browser setting,0,1,-0.9999990000010001,4,0.24999993750001562,Most Negative
784,thanks to a lot of great autopilot ai hardware &amp software engineers at tesla,1,0,0.9999990000010001,10,0.09999999000000101,Most Positive
785,for sure,0,0,0.0,0,0.0,Neutral
786,will be worth it,1,0,0.9999990000010001,1,0.9999990000010001,Most Positive
787,exactly,0,0,0.0,0,0.0,Neutral
788,sure,0,0,0.0,0,0.0,Neutral
789,actually its still there,0,0,0.0,0,0.0,Neutral
790,wait until you see what cybertruck will do,0,0,0.0,2,0.0,Neutral
791,this is accidental will be back shortly,0,1,-0.9999990000010001,3,0.33333322222225925,Most Negative
792, k superchargers and counting,0,0,0.0,2,0.0,Neutral
793,am hoping to change booster design to land back on launch mount with,0,0,0.0,8,0.0,Neutral
794,chip has temp sensor &amp automatically maintains safe temp,1,0,0.9999990000010001,9,0.11111109876543349,Most Positive
795,enough already on my plate &amp teslas maybe one day will do a prototy,1,0,0.9999990000010001,6,0.16666663888889352,Most Positive
796,neuralink wont overclock the brain it will transfer processing to the supercomputer extension of yo,0,0,0.0,9,0.0,Neutral
797,we rewrote all labeling software for d very different from labeling single phot,0,0,0.0,6,0.0,Neutral
798,version is about a year away,0,0,0.0,2,0.0,Neutral
799,it would appear that their calculations were incorrect,0,1,-0.9999990000010001,2,0.499999750000125,Most Negative
800,china understands the profound importance of reusability the era of expendable rockets will soon be over,1,0,0.9999990000010001,8,0.12499998437500197,Most Positive
801,u+u+fefu+u+fef tesla autopilot ai team u+u+fefu+u+fef,0,0,0.0,6,0.0,Neutral
802,good explanation d is essential for dynamically occluded objects especially in large intersection,1,1,0.0,8,0.24999996875000394,Neutral
803,,0,0,0.0,0,0.0,Neutral
804,the phantom of the opera is here inside your mind,0,0,0.0,4,0.0,Neutral
805,u+feu+fe u+f,0,0,0.0,2,0.0,Neutral
806,just looking for problem solvers who get things done with a high sense of urgency dont care if or where they went to school,0,1,-0.9999990000010001,9,0.11111109876543349,Most Negative
807,when sending your resume please describe a few of the hardest problems you solved &amp exactly how you solved them,0,1,-0.9999990000010001,9,0.11111109876543349,Most Negative
808,a new banner is neededneither hard left nor right,1,1,0.0,4,0.49999987500003124,Neutral
809,another fine day in the simulation,1,0,0.9999990000010001,3,0.33333322222225925,Most Positive
810,faraday invented the electric motor tesla the commutator free three phase ac induction motor in other,1,0,0.9999990000010001,11,0.09090908264462885,Most Positive
811,maxwell was amazing should have more recognition tesla motors inc was almost called faraday as it to,1,0,0.9999990000010001,7,0.1428571224489825,Most Positive
812,is ten times better than,1,0,0.9999990000010001,2,0.499999750000125,Most Positive
813,u+f,0,0,0.0,1,0.0,Neutral
814, deployment of gps iii  confirmed,0,0,0.0,4,0.0,Neutral
815, falcon s first stage lands on the of course i still love you droneship,1,0,0.9999990000010001,5,0.199999960000008,Most Positive
816, liftoff,0,0,0.0,1,0.0,Neutral
817,awaiting approval from canadian authorities,1,0,0.9999990000010001,4,0.24999993750001562,Most Positive
818,recruiting ace engineers for giga berlin will interview in person tomorrow on site send resume to gunscom,0,0,0.0,12,0.0,Neutral
819,stop being a chad,0,0,0.0,2,0.0,Neutral
820,uh chad wtf,0,0,0.0,3,0.0,Neutral
821,einstein was great but did not succeed at engineering and he tried,2,0,0.99999950000025,4,0.49999987500003124,Most Positive
822,yeah that will be relatively easy as so few users out in the ocean,1,0,0.9999990000010001,4,0.24999993750001562,Most Positive
823,yes although i didnt expect the stock to rise so much so,0,0,0.0,4,0.0,Neutral
824,super appreciate your support steve that convertible loan gave us months of runway,3,0,0.9999996666667778,8,0.3749999531250059,Most Positive
825,closest we got was about a month the model ramp was extreme stress &amp pa,0,1,-0.9999990000010001,9,0.11111109876543349,Most Negative
826,i put in my last money even though i thought we would still fail but it was eithe,0,1,-0.9999990000010001,5,0.199999960000008,Most Negative
827,that funding round completed pm on christmas eve in  last hour of last day possible as investo,0,0,0.0,9,0.0,Neutral
828,yes,0,0,0.0,0,0.0,Neutral
829,lowering starlink terminal cost which may sound rather pedestrian is actually our most difficult technical challenge,0,1,-0.9999990000010001,9,0.11111109876543349,Most Negative
830,as soon as we get regulatory approval hopefully around middle of next year,1,0,0.9999990000010001,4,0.24999993750001562,Most Positive
831,right now it takes about mins to set up but with future improvements probably less than mi,2,0,0.99999950000025,6,0.33333327777778704,Most Positive
832,canada and norway are next after we get us out of early beta,0,0,0.0,4,0.0,Neutral
833,didnt realize that was possible no problem if theres a way get current design cybertruck approved in europe,0,1,-0.9999990000010001,8,0.12499998437500197,Most Negative
834,as soon as we get country approval this is required for each country individually as no eu wide approval,2,0,0.99999950000025,8,0.24999996875000394,Most Positive
835,lower latitude states need more satellites in position so probably january,0,0,0.0,6,0.0,Neutral
836,several thousand more starlink beta participation invitations going out this week,0,0,0.0,6,0.0,Neutral
837,new design is better with many minor tweaks even the small details matter,1,0,0.9999990000010001,6,0.16666663888889352,Most Positive
838,haha,0,0,0.0,1,0.0,Neutral
839,very close to actual expected flight,0,0,0.0,4,0.0,Neutral
840,i could not be more excited about the new supercollider that said while it is considerably larger,1,0,0.9999990000010001,4,0.24999993750001562,Most Positive
841,,0,0,0.0,0,0.0,Neutral
842,,0,0,0.0,0,0.0,Neutral
843,tesla tex,0,0,0.0,2,0.0,Neutral
844,yes,0,0,0.0,0,0.0,Neutral
845,penguin random house u+f should change the name to random penguinu+f,0,0,0.0,7,0.0,Neutral
846,sure although it might be quite a short livestream lot can go wrong but well provide video wa,1,1,0.0,7,0.285714244897965,Neutral
847,this is what matters most,0,0,0.0,1,0.0,Neutral
848,weve tested a sub scale version in a wind tunnel with active aero clos,0,0,0.0,9,0.0,Neutral
849,,0,0,0.0,0,0.0,Neutral
850,lord of the,0,0,0.0,1,0.0,Neutral
851,yeah although if it fails right at the end some landing,1,1,0.0,4,0.49999987500003124,Neutral
852,minor,0,0,0.0,1,0.0,Neutral
853,understanding exactly how the body flaps control pitch yaw &amp roll duri,0,0,0.0,10,0.0,Neutral
854,but a rud right off launch pad is also possible fortunately sn is almost ready,3,0,0.9999996666667778,6,0.49999991666668053,Most Positive
855,stable controlled descent with body flaps would be great transferring propellant,2,0,0.99999950000025,8,0.24999996875000394,Most Positive
856,every to days,0,0,0.0,1,0.0,Neutral
857,faults will never be zero but at some point the probability of a fault wi,0,2,-0.99999950000025,5,0.399999920000016,Most Negative
858,we measure this primarily in intervention probability this update addressed several issu,0,0,0.0,7,0.0,Neutral
859,thanks to a great autopilot ai team working super hard doing neural nets without testing them again,2,1,0.33333322222225925,10,0.299999970000003,Positive
860,latency will improve significantly soon bandwidth too,1,1,0.0,4,0.49999987500003124,Neutral
861,this build should be noticeably better with interventions,1,0,0.9999990000010001,3,0.33333322222225925,Most Positive
862,yes,0,0,0.0,0,0.0,Neutral
863,ive spent more than half my life in california &amp love the state but frankly i think,1,0,0.9999990000010001,10,0.09999999000000101,Most Positive
864,and sweden is still right with zero deaths oct,1,0,0.9999990000010001,3,0.33333322222225925,Most Positive
865,true also fewer heart attacks as way easier to pump blood in  gravity,1,1,0.0,8,0.24999996875000394,Neutral
866,now were talking also stephenson   is in the constellation scrotum haha,0,0,0.0,5,0.0,Neutral
867,small fry the sun converts over million tons of mass to energy every second,0,0,0.0,8,0.0,Neutral
868,accurate,1,0,0.9999990000010001,1,0.9999990000010001,Most Positive
869,,0,0,0.0,0,0.0,Neutral
870,some challenges with high winds looks like sunday for static fire,1,1,0.0,6,0.33333327777778704,Neutral
871,great shot,1,0,0.9999990000010001,2,0.499999750000125,Most Positive
872,future ai will appreciate this,1,0,0.9999990000010001,2,0.499999750000125,Most Positive
