,Text_clean,positive_score,negative_score,polarity_score,number_words,subjectivity,Sentiment
873,truth is stranger than fiction,0,2,-0.99999950000025,3,0.6666664444445185,Most Negative
874,u+f,0,0,0.0,1,0.0,Neutral
875,urf is so smol,0,0,0.0,2,0.0,Neutral
876,for a long time,0,0,0.0,2,0.0,Neutral
877,truth be told ive eaten at jitb many times over the years even the teriyaki bowl,0,0,0.0,9,0.0,Neutral
878,might buy a jack in the box footstool,0,0,0.0,4,0.0,Neutral
879,approximately lograte,0,0,0.0,2,0.0,Neutral
880,same bot just change setting to combat,0,0,0.0,4,0.0,Neutral
881,well being a phased array antenna it is actually rather flat,1,0,0.9999990000010001,4,0.24999993750001562,Most Positive
882,tesla should make u+f catgirl robots,0,0,0.0,5,0.0,Neutral
883,little crane am i just a toy to you,0,0,0.0,2,0.0,Neutral
884,u+fu+f,0,0,0.0,1,0.0,Neutral
885,come here no come here u+f,0,0,0.0,1,0.0,Neutral
886,wow this mayo sure is salty,1,0,0.9999990000010001,3,0.33333322222225925,Most Positive
887,max payne was great on many levels silent hill good too,3,0,0.9999996666667778,7,0.4285713673469475,Most Positive
888,jack in the box should do double duty as a sperm donor clinic name is u+fc,0,0,0.0,8,0.0,Neutral
889,one of the best games ever,1,0,0.9999990000010001,1,0.9999990000010001,Most Positive
890,fear with modern graphics &amp sound would rock,1,1,0.0,7,0.285714244897965,Neutral
891,ok,0,0,0.0,0,0.0,Neutral
892,all games in this thread are far scarier &amp more creatively so than any horror movie,0,1,-0.9999990000010001,8,0.12499998437500197,Most Negative
893,fear is best imo also dead space  they will haunt your dreams,1,3,-0.49999987500003124,6,0.6666665555555741,Negative
894,,0,0,0.0,0,0.0,Neutral
895,to the best of my knowledge literally zero equipment was usable without major repairs or upgra,2,0,0.99999950000025,7,0.285714244897965,Most Positive
896,all that was left were broken bots &amp equipment hardly worth the scrap metal value but we scrounged up spa,1,2,-0.33333322222225925,11,0.2727272479338866,Negative
897,and there were actually zero employees in the factory after gm toyota left they took all good equipment &amp,1,0,0.9999990000010001,9,0.11111109876543349,Most Positive
898,bettern nothin or ur u+fb back,0,0,0.0,5,0.0,Neutral
899,u+fab u+ff,0,0,0.0,2,0.0,Neutral
900,tesla team has done great work,2,0,0.99999950000025,4,0.49999987500003124,Most Positive
901,well tbh our capex efficiency in was trash u+fc,1,1,0.0,5,0.399999920000016,Neutral
902,testing for covid is a license to print money,0,0,0.0,5,0.0,Neutral
903,yes very helpful thanks all beta testers,1,0,0.9999990000010001,3,0.33333322222225925,Most Positive
904,video training &amp inference is essential for excellent autonomy,1,0,0.9999990000010001,8,0.12499998437500197,Most Positive
905,sigh there should be a new supersonic jet this time electric,0,0,0.0,5,0.0,Neutral
906,critical to humanitys future,0,1,-0.9999990000010001,3,0.33333322222225925,Most Negative
907,congratulations spacex team,1,0,0.9999990000010001,3,0.33333322222225925,Most Positive
908,mine is a few days ahead,0,0,0.0,3,0.0,Neutral
909,sure it could be an option in settings,0,0,0.0,2,0.0,Neutral
910,visualization will tone down significantly for production these are intentionally strident colors,0,1,-0.9999990000010001,7,0.1428571224489825,Most Negative
911,sure,0,0,0.0,0,0.0,Neutral
912,im in boca every week so maybe we could talk th,0,0,0.0,4,0.0,Neutral
913,good point probably next week in form of a written piece on spacex website,1,0,0.9999990000010001,8,0.12499998437500197,Most Positive
914,great pics that we now have the beginnings of a starship production system is most meaningful,2,0,0.99999950000025,7,0.285714244897965,Most Positive
915,yup with beta updates therell be a lot of steps fwd step back situations but pace of improv,0,0,0.0,12,0.0,Neutral
916,working on it also needs to be able fart at other cars on command,0,0,0.0,4,0.0,Neutral
917,starship is coming together,0,0,0.0,2,0.0,Neutral
918,price change is pushed to thursday next week applies only to us for now one week clock will start in other countr,0,0,0.0,10,0.0,Neutral
919,there will be a deg glass star bar name tbd at top of high bay,1,0,0.9999990000010001,8,0.12499998437500197,Most Positive
920,well we have said many times that the price will rise as the product functionality improves how much ti,2,0,0.99999950000025,7,0.285714244897965,Most Positive
921,agreed are these performance tires,0,0,0.0,3,0.0,Neutral
922,just a small seeming issue with loss of upper stage camera probably nothing serious but standing down to,0,2,-0.99999950000025,7,0.285714244897965,Most Negative
923,sure,0,0,0.0,0,0.0,Neutral
924,now that tesla fsd beta is out in limited release fsd price new or upgrade will go up by ~k on monday,0,1,-0.9999990000010001,10,0.09999999000000101,Most Negative
925,as soon as we complete testing &amp regulators approve so many differe,1,0,0.9999990000010001,7,0.1428571224489825,Most Positive
926,yes,0,0,0.0,0,0.0,Neutral
927,haha,0,0,0.0,1,0.0,Neutral
928,dependent on proving high safety,1,0,0.9999990000010001,4,0.24999993750001562,Most Positive
929,not intentional we just wanted to show that you could theoretically convert the entire us vehicle f,0,0,0.0,7,0.0,Neutral
930,cold gas for now hot later,1,1,0.0,3,0.6666664444445185,Neutral
931,i mean ya gotta have a tiki bar,0,0,0.0,4,0.0,Neutral
932,starship nosecone high bay &amp tiki bar,0,0,0.0,8,0.0,Neutral
933,,0,0,0.0,0,0.0,Neutral
934,after it gets to orbit a few times,0,0,0.0,2,0.0,Neutral
935,got a little melty tbh,0,0,0.0,2,0.0,Neutral
936,those engines could go bar but would be dicey pushing it for near term tests doesnt achieve,0,0,0.0,8,0.0,Neutral
937,raptor has now run for secs at bar chamber pressure before encountering issues mt f sea,0,1,-0.9999990000010001,10,0.09999999000000101,Most Negative
938,fsd beta rollout happening tonight will be extremely slow &amp cautious as it should,0,1,-0.9999990000010001,10,0.09999999000000101,Most Negative
939,data from engine starship static fire this morning looks good proceeding with nosecone mate,1,1,0.0,10,0.19999998000000202,Neutral
940,yes we also have to consider population life months lost from lockdowns &amp other restriction,0,2,-0.99999950000025,8,0.24999996875000394,Most Negative
941,sweden at zero deaths oct,0,0,0.0,3,0.0,Neutral
942,yes,0,0,0.0,0,0.0,Neutral
943,firmware is probably a slightly more accurate description but yes,1,0,0.9999990000010001,4,0.24999993750001562,Most Positive
944, theres no place like homeespecially if it has a solar roofthis kansas ranch got theirs installed in days,1,0,0.9999990000010001,8,0.12499998437500197,Most Positive
945,mobi c has too much mobility fusion has too little we need mobi d haha,0,0,0.0,5,0.0,Neutral
946,actually its my neck,0,0,0.0,1,0.0,Neutral
947,maybe i can be helpful had mobi c disc put in at c c however st surgery failed to remov,1,1,0.0,8,0.24999996875000394,Neutral
948,pretty accurate its not so much dna sequencing as it is using synthetic dna rna to fix bugs in our code,2,1,0.33333322222225925,10,0.299999970000003,Positive
949,london to beijing would be cool,1,0,0.9999990000010001,3,0.33333322222225925,Most Positive
950,wow that would be quite a trip,1,0,0.9999990000010001,2,0.499999750000125,Most Positive
951,thats my kid haha,0,0,0.0,2,0.0,Neutral
952,mtr trnd,0,0,0.0,2,0.0,Neutral
953,looks like snoopy,1,0,0.9999990000010001,1,0.9999990000010001,Most Positive
954,current production is slightly better,1,0,0.9999990000010001,3,0.33333322222225925,Most Positive
955,doesnt seem to be any life in this solar system maybe under the ice of europa or,0,0,0.0,6,0.0,Neutral
956, tesla model sr+ has lowest energy consumption of all bevs says report,0,0,0.0,8,0.0,Neutral
957,very creative,1,0,0.9999990000010001,1,0.9999990000010001,Most Positive
958,that free fusion reactor in the sky conveniently converts ~ million tons of mass into energy every second,2,0,0.99999950000025,11,0.1818181652892577,Most Positive
959,you never know,0,0,0.0,0,0.0,Neutral
960,after,0,0,0.0,0,0.0,Neutral
961,u+f,0,0,0.0,1,0.0,Neutral
962,also system should autodelete old data automatically by default,0,0,0.0,5,0.0,Neutral
963,table in tension,0,1,-0.9999990000010001,2,0.499999750000125,Most Negative
964,yes,0,0,0.0,0,0.0,Neutral
965,starting production on seater next month initial deliveries early december,0,0,0.0,8,0.0,Neutral
966,the gauntlet has been thrown down the prophecy will be fulfilled model s price changes to  tonight,0,0,0.0,7,0.0,Neutral
967,,0,0,0.0,0,0.0,Neutral
968,congratulations,1,0,0.9999990000010001,1,0.9999990000010001,Most Positive
969,making progress,1,0,0.9999990000010001,2,0.499999750000125,Most Positive
970,meter or roughly ft diameter,0,0,0.0,4,0.0,Neutral
971,will be less roomy with vacuum rocket engines added,1,0,0.9999990000010001,5,0.199999960000008,Most Positive
972,its still there but focus is vegas &amp prufrock our new tunneling machine,0,0,0.0,7,0.0,Neutral
973,for sure,0,0,0.0,0,0.0,Neutral
974,maybe a month or so some finishing touches need to be done on the stations,0,0,0.0,4,0.0,Neutral
975,we simplified this a lot its basically just teslas in tunnels at this point,1,0,0.9999990000010001,6,0.16666663888889352,Most Positive
976,sweet,1,0,0.9999990000010001,1,0.9999990000010001,Most Positive
977,yes everything is slow to a phased array antenna,0,1,-0.9999990000010001,4,0.24999993750001562,Most Negative
978,nice,1,0,0.9999990000010001,1,0.9999990000010001,Most Positive
979,what is love baby dont hurt me winston churchill,1,1,0.0,6,0.33333327777778704,Neutral
980,or maybe weak turrets to allow more strategic degrees of freedom,1,1,0.0,5,0.399999920000016,Neutral
981,please buff torbs turret,0,0,0.0,3,0.0,Neutral
982,um yes,0,0,0.0,1,0.0,Neutral
983,i have goosebumps merch not sure how tbh,0,0,0.0,3,0.0,Neutral
984,hgg,0,0,0.0,1,0.0,Neutral
985,lotr,0,0,0.0,1,0.0,Neutral
986,u+f the illuminaughty u+f,0,0,0.0,3,0.0,Neutral
987,knee deep,0,0,0.0,2,0.0,Neutral
988, this will be the first flight of the upgraded cargo version of dragon which is able to carry  more science payloads than th,1,0,0.9999990000010001,8,0.12499998437500197,Most Positive
989, the dragon spacecraft supporting spacexs st cargo resupply mission to the departed our hawthorne factory last,1,0,0.9999990000010001,11,0.09090908264462885,Most Positive
990,yeah,0,0,0.0,1,0.0,Neutral
991,at least success is in the set of all possible outcomes this time,1,0,0.9999990000010001,4,0.24999993750001562,Most Positive
992,diess is doing his best to move in the right direction but hes in a tough position wi,3,0,0.9999996666667778,7,0.4285713673469475,Most Positive
993,good grief spacex is getting zero money for this starship is designed to carry people &amp cargo around ear,1,1,0.0,12,0.16666665277777895,Neutral
994,with fsd we got stuck in a lot of local maximums which wasnt clear until we hit the ceiling this time its right,2,1,0.33333322222225925,10,0.299999970000003,Positive
995,thank you much more accurate haha,2,0,0.99999950000025,2,0.99999950000025,Most Positive
996,this graph appears to be upside down,0,0,0.0,3,0.0,Neutral
997,sheer magnitude of the entire production system is hard to appreciate almost every element of productio,1,1,0.0,8,0.24999996875000394,Neutral
998,will release order configurator probably in jan,0,0,0.0,4,0.0,Neutral
999,limited fsd beta releasing on tuesday next week as promised this will at first be limited to a s,1,2,-0.33333322222225925,8,0.3749999531250059,Negative
1000,the socs sync with each other to times sec exchanging output of nns that should be in,0,0,0.0,7,0.0,Neutral
1001,tesla fsd computers dual socs function like twin engines on planes they each run different neural nets,1,0,0.9999990000010001,12,0.08333332638888948,Most Positive
1002,accurate analysis quite a few ego intelligence&gt&gt people in your comment thread haha neither mobileye,2,0,0.99999950000025,13,0.15384614201183525,Most Positive
1003,,0,0,0.0,0,0.0,Neutral
1004,glad jen is safe,2,0,0.99999950000025,3,0.6666664444445185,Most Positive
1005,wow,1,0,0.9999990000010001,1,0.9999990000010001,Most Positive
1006,uh ok here we go,0,0,0.0,1,0.0,Neutral
1007,i dont think this is accurate,1,0,0.9999990000010001,2,0.499999750000125,Most Positive
1008,yeah there are lite,0,0,0.0,2,0.0,Neutral
1009,even if half that amount its still a big deal,0,0,0.0,4,0.0,Neutral
1010,u+fu+f,0,0,0.0,1,0.0,Neutral
1011,i have seen no evidence of an advanc,0,0,0.0,2,0.0,Neutral
1012,we face a tough dichotomy of applying resources to the old architecture or applying them to the ne,1,0,0.9999990000010001,8,0.12499998437500197,Most Positive
1013,definitely,0,0,0.0,0,0.0,Neutral
1014,exactly he plays the poor inventor card but was rich all along &amp invented nothing as far as i kn,1,1,0.0,9,0.22222219753086697,Neutral
1015,there are sketchy edits to tesla wiki that whitewash eberhards problems glorify his role pretty odd,2,3,-0.199999960000008,11,0.4545454132231443,Negative
1016,when eberhard was fired from the tesla ceo role in mid for providing false information to me &amp t,0,1,-0.9999990000010001,11,0.09090908264462885,Most Negative
1017,interesting,1,0,0.9999990000010001,1,0.9999990000010001,Most Positive
1018, the future of cars can and will be electric if the entire industry starts making and marketing compelling evs for everyone,0,0,0.0,10,0.0,Neutral
1019,,0,0,0.0,0,0.0,Neutral
1020,probably,0,0,0.0,0,0.0,Neutral
1021,i have that exact art on the wall of the place i stay in boca chica,0,0,0.0,7,0.0,Neutral
1022,yes failure to protect nursing homes was a major mistake happened in most countries,1,2,-0.33333322222225925,8,0.3749999531250059,Negative
1023,sweden was right,1,0,0.9999990000010001,1,0.9999990000010001,Most Positive
1024,,0,0,0.0,0,0.0,Neutral
1025,great work by spacex valve engineering &amp production,2,0,0.99999950000025,8,0.24999996875000394,Most Positive
1026,our tiles are mechanically attached,0,0,0.0,3,0.0,Neutral
1027,it m,0,0,0.0,0,0.0,Neutral
1028,tiles will be,0,0,0.0,1,0.0,Neutral
1029,compilers need to improve imo most type pointer or other memory problems can be detected at comp,1,1,0.0,9,0.22222219753086697,Neutral
1030,im proud to say that that nose is pointier than it needs to be haha,1,0,0.9999990000010001,5,0.199999960000008,Most Positive
1031, we put the model y long range electric suv on our test track to find out what it can doand it turns out well,1,0,0.9999990000010001,11,0.09090908264462885,Most Positive
1032,norway leads the world,1,0,0.9999990000010001,3,0.33333322222225925,Most Positive
1033,passed cryo proof,0,0,0.0,3,0.0,Neutral
1034,u+fd,0,0,0.0,1,0.0,Neutral
1035,yeah its not a contest advanced casting crushes best case d printing but casting doesnt work wel,3,0,0.9999996666667778,11,0.2727272479338866,Most Positive
1036,great pics,1,0,0.9999990000010001,2,0.499999750000125,Most Positive
1037,maybe this should be the flag of mars,0,0,0.0,2,0.0,Neutral
1038,additive manufacturing of parts is still far too costly for cars but can rapidly create tooling to accel,0,1,-0.9999990000010001,9,0.11111109876543349,Most Negative
1039,pretty much but i think it may end on a high note,1,0,0.9999990000010001,4,0.24999993750001562,Most Positive
1040, starman last seen leaving earth made its first close approach with mars todaywithin astronomical units or under mill,0,0,0.0,11,0.0,Neutral
1041,meant to say that it should be fixed in the latest wide release wont need to wait for fsd,0,0,0.0,8,0.0,Neutral
1042,it should be,0,0,0.0,0,0.0,Neutral
1043,exactly we barked up that tree for way too long sigh gives a false sense of,0,1,-0.9999990000010001,6,0.16666663888889352,Most Negative
1044,yes we will play sexy snake jazz u+f,1,0,0.9999990000010001,5,0.199999960000008,Most Positive
1045,yes,0,0,0.0,0,0.0,Neutral
1046,yeah provided we do our metal gear snake autocoupler,0,0,0.0,6,0.0,Neutral
1047,waymo is impressive but a highly specialized solution the tesla approach is a general solution the lat,1,0,0.9999990000010001,10,0.09999999000000101,Most Positive
1048,yeah we could put in a setting allowing it to drop as low as ,0,0,0.0,6,0.0,Neutral
1049,great render note there will need to be an arm,1,0,0.9999990000010001,4,0.24999993750001562,Most Positive
1050,mimecraft,0,0,0.0,1,0.0,Neutral
1051,yes,0,0,0.0,0,0.0,Neutral
1052,autopilot team is making great progress reality sure is complicated,2,1,0.33333322222225925,7,0.4285713673469475,Positive
1053,aspiring to have no flame diverter in boca,0,0,0.0,4,0.0,Neutral
1054,we do have giant steel balls haha,0,0,0.0,4,0.0,Neutral
1055,we just completed a financing round but will let you know when there is another one,0,0,0.0,3,0.0,Neutral
1056,i definitely need to try these tasty cakes &amp pastries on my next visit,0,0,0.0,6,0.0,Neutral
1057,mass ratio liquid oxygen is much denser than liquid m,0,0,0.0,6,0.0,Neutral
1058,had the most amazing kebab ever just outside of tacheles too,1,0,0.9999990000010001,3,0.33333322222225925,Most Positive
1059,dner kebab,0,0,0.0,2,0.0,Neutral
1060,youre most welcome,1,0,0.9999990000010001,1,0.9999990000010001,Most Positive
1061,high bay should be finished except for the giant gantry crane within,0,0,0.0,6,0.0,Neutral
1062,that looks tasty,0,0,0.0,1,0.0,Neutral
1063,the crash absorption rails can be cut off &amp replaced with a bolted part for collision repair,0,1,-0.9999990000010001,11,0.09090908264462885,Most Negative
1064,sandy munro understands engineering,0,0,0.0,4,0.0,Neutral
1065,that would be like licensing battlestar galactica actually buil,1,0,0.9999990000010001,4,0.24999993750001562,Most Positive
1066,yes the gigafactory is the hardest &amp most critical product,0,1,-0.9999990000010001,6,0.16666663888889352,Most Negative
1067,battery pack will be a bonded structure with cells providing shear transfer b,0,0,0.0,8,0.0,Neutral
1068,but now we understand production much better it will be our primary competitive advantage long term,3,0,0.9999996666667778,7,0.4285713673469475,Most Positive
1069,even gm &amp chrysler went bankrupt in  ford and tesla are the only us car companies t,0,1,-0.9999990000010001,9,0.11111109876543349,Most Negative
1070,the model production ramp was sheer agony for two years but that was do or die for te,0,2,-0.99999950000025,8,0.24999996875000394,Most Negative
1071,bringing a new product to volume production is  inspiration &amp  perspiration you do st,1,0,0.9999990000010001,9,0.11111109876543349,Most Positive
1072,marginal cost of starship mass to orbit should be well under  kg fully burdened cost depends on flight rate,1,1,0.0,12,0.16666665277777895,Neutral
1073,prototypes are a piece of cake but high volume production of a new technology is extremely hard ta,0,1,-0.9999990000010001,10,0.09999999000000101,Most Negative
1074,we do expect to make heavy use of lfp for medium range cars &amp stationary storage,0,0,0.0,11,0.0,Neutral
1075,berlin will use cell with structural battery pack &amp front &amp rear single piece castings also a,0,0,0.0,14,0.0,Neutral
1076,they are,0,0,0.0,0,0.0,Neutral
1077,i do so wish that more companies would put down their spreadsheets for a moment and focus on making,0,0,0.0,6,0.0,Neutral
1078,bar absolute which is fine for,1,0,0.9999990000010001,3,0.33333322222225925,Most Positive
1079,cryo pressure test succeeded but a small le,1,0,0.9999990000010001,6,0.16666663888889352,Most Positive
1080,one of the best shots ever,1,0,0.9999990000010001,1,0.9999990000010001,Most Positive
1081,much sooner,0,0,0.0,1,0.0,Neutral
1082,great photo,1,0,0.9999990000010001,2,0.499999750000125,Most Positive
1083,it will soon,0,0,0.0,0,0.0,Neutral
1084, falcon launches starlink satellites to orbit completing spacexs rd flight of a previously flown rocket booster https ,0,0,0.0,13,0.0,Neutral
1085,once these satellites reach their target position we will be able to roll out a fairly wide public beta in,1,0,0.9999990000010001,9,0.11111109876543349,Most Positive
1086, deployment of starlink satellites confirmed,0,0,0.0,4,0.0,Neutral
1087,were not seeing notable differences yet i think the boosters could probably do + reflig,0,0,0.0,5,0.0,Neutral
1088,roughly a week or two turnaround is all thats needed to meet max launch demand starship s,0,0,0.0,9,0.0,Neutral
1089,ahem yes it was the rd flight of this booster &amp rd flight for active half of fairing aiming for,0,0,0.0,10,0.0,Neutral
1090,th flight &amp landing for this booster,0,0,0.0,5,0.0,Neutral
1091,minutes from launch looks good so far,1,0,0.9999990000010001,3,0.33333322222225925,Most Positive
1092,so crazy to subsidize pollution this is not good for people especially in dense cities with heavy,2,2,0.0,8,0.4999999375000079,Neutral
1093,its a step in the right direction but they should really aim for full reusability by  larger ro,1,0,0.9999990000010001,7,0.1428571224489825,Most Positive
1094,turn volume to &amp play powerglide in your tesla,0,0,0.0,7,0.0,Neutral
1095,fsd will solve these issues,0,1,-0.9999990000010001,3,0.33333322222225925,Most Negative
1096,music volume on a tesla goes to  because its louder than,0,1,-0.9999990000010001,4,0.24999993750001562,Most Negative
1097,one of my favorite writers foundation is tough to make into a movie but has outstanding potential,3,0,0.9999996666667778,8,0.3749999531250059,Most Positive
1098,u+faf,0,0,0.0,1,0.0,Neutral
1099,,0,0,0.0,0,0.0,Neutral
1100,rewatched young frankenstein this weekend still awesome ovaltine,1,0,0.9999990000010001,6,0.16666663888889352,Most Positive
1101,the remake has the potential to be great i kinda liked the original tbh but its possible to take it up a level,2,0,0.99999950000025,7,0.285714244897965,Most Positive
1102,hollywood should just start with the sequel &amp skip the original because financials,0,0,0.0,8,0.0,Neutral
1103,this article is wildly incorrect about lithium battery costs by a factor of or more presently &amp x long term,0,2,-0.99999950000025,12,0.16666665277777895,Most Negative
1104,pretty wild,1,1,0.0,2,0.99999950000025,Neutral
1105,new spacex droneship will be called a shortfall of gravitas,0,0,0.0,5,0.0,Neutral
1106,nothing can escape gravity not even black holes and they really tried,0,0,0.0,4,0.0,Neutral
1107,would be cool to put yourself in the mind of the car while its driving,1,0,0.9999990000010001,5,0.199999960000008,Most Positive
1108,coming soon,0,0,0.0,1,0.0,Neutral
1109,call of booty great game,1,0,0.9999990000010001,4,0.24999993750001562,Most Positive
1110,,0,0,0.0,0,0.0,Neutral
1111,vector space birds eye view coming with fsd,0,0,0.0,7,0.0,Neutral
1112,unexpected pressure rise in the turbomachinery gas generator,0,1,-0.9999990000010001,6,0.16666663888889352,Most Negative
1113,all of that and more were doing a broad review of launch site propulsion structures av,0,0,0.0,7,0.0,Neutral
1114,exactly,0,0,0.0,0,0.0,Neutral
1115,we will need to make a lot of improvements to have a chance of completing launches next year,1,0,0.9999990000010001,7,0.1428571224489825,Most Positive
1116,i agree with lex,0,0,0.0,2,0.0,Neutral
1117,glad youre ok,1,0,0.9999990000010001,2,0.499999750000125,Most Positive
1118,haha,0,0,0.0,1,0.0,Neutral
1119,thanks for waiting,0,0,0.0,1,0.0,Neutral
1120,next year for sure,0,0,0.0,1,0.0,Neutral
1121,,0,0,0.0,0,0.0,Neutral
1122,,0,0,0.0,0,0.0,Neutral
1123,great,1,0,0.9999990000010001,1,0.9999990000010001,Most Positive
1124,browns,0,0,0.0,1,0.0,Neutral
1125,average latency will improve as more sat,1,1,0.0,4,0.49999987500003124,Neutral
1126,very s,0,0,0.0,0,0.0,Neutral
1127,yes starlink is design,0,0,0.0,2,0.0,Neutral
1128,probably or with an optimized tanker a,0,0,0.0,2,0.0,Neutral
1129,starlink will be a revolution in connectivity esp,0,0,0.0,4,0.0,Neutral
1130,yeah,0,0,0.0,1,0.0,Neutral
1131,great letter it will be increasingl,1,0,0.9999990000010001,3,0.33333322222225925,Most Positive
1132,the ship rings are thicker than they need to be for,0,1,-0.9999990000010001,3,0.33333322222225925,Most Negative
1133,its next level,0,0,0.0,1,0.0,Neutral
1134,u+fbu+fau+f,0,0,0.0,1,0.0,Neutral
1135,glad to hear your mom is ok,1,0,0.9999990000010001,3,0.33333322222225925,Most Positive
1136,good to see inspiring for future of space,2,0,0.99999950000025,4,0.49999987500003124,Most Positive
1137,the new heat pump in model y is what re,0,0,0.0,3,0.0,Neutral
1138,yes coming soon,0,0,0.0,1,0.0,Neutral
1139,great render the circumferentia,1,0,0.9999990000010001,3,0.33333322222225925,Most Positive
1140,thats very hard to do have you tried pushing on the c,0,1,-0.9999990000010001,2,0.499999750000125,Most Negative
1141,its cool &amp for sure can &amp should be done but i suspect its best cas,2,1,0.33333322222225925,7,0.4285713673469475,Positive
1142,weld esthetics will improve greatly in upcoming starships,1,0,0.9999990000010001,6,0.16666663888889352,Most Positive
1143,haha true why do showers have such a wide range,0,0,0.0,5,0.0,Neutral
1144,,0,0,0.0,0,0.0,Neutral
1145,yes,0,0,0.0,0,0.0,Neutral
1146,light is not as fast as youd think,1,0,0.9999990000010001,3,0.33333322222225925,Most Positive
1147, once this dragon docks to the  there will be two dragons docked simultaneously between crew and cargo missions,0,0,0.0,8,0.0,Neutral
1148, spacex training of astronauts that will fly on board dragons first operational mission is complete when the crew arrives for,0,0,0.0,11,0.0,Neutral
1149, after launch of crew dragons first operational mission with astronauts on board spacex will launch its st cargo resupply mi,0,0,0.0,13,0.0,Neutral
1150,maybe we used too many magenta spotlights,0,0,0.0,2,0.0,Neutral
1151, news were now targeting am et saturday oct  for the launch of the and crew  mission to send ast,0,0,0.0,9,0.0,Neutral
1152,having a low center of gravity makes a world of difference to safety,0,0,0.0,7,0.0,Neutral
1153,we will probably ipo starlink but only several years in the future when revenue growth is,0,0,0.0,6,0.0,Neutral
